tweet_id,date,username,tweet,source,retweet_count,user_location,user_place,coordinates
1348685344242348035,11-01-2021,Roreku1,Moodle ist im Trend?! Sowohl im Sommersemester noch im aktuellen Wintersemester ist Moodle einen Funken zuverlässig! Wer ist Schuld? Corona? Moodle? Meine Uni? Deutschland ist nicht fit genug für die Online Lehre... ich wage es mal zu behaupten aktuell sogar zu blöd! #Moodle,Twitter Web App,0,,,
1348685336998776832,11-01-2021,textzicke,"Öha, ich habe zu den WTF-Momenten der heute in Kraft getretenen Corona-Maßnahmen gebloggt! https://t.co/89CnUrh0Sh",Twitter Web App,5,"Oberbayern, zefix!",,
1348685326949220352,11-01-2021,GarbaciakMichal,😔.... Krankenwagen warten bis zu neun Stunden vor der Notaufnahme https://t.co/sU6yZ8Veva via @zeitonline,Twitter for iPhone,0,"Hessen, Taunus",,
1348685320146006024,11-01-2021,libiseller_ai,"GLS ist so frech, dass sie sogar im Lockdown nicht anläuten und direkt in den Paketshop liefern. Kann man das eigentlich auf Vertragserfüllung klagen?",Twitter Web App,0,"Vienna, Europe",,
1348685306850136071,11-01-2021,WoSchBonn,Ein Fall in meinem Umfeld: Teilzeitkraft im kommunalen öD in RLP kann wg. #Corona nicht die vereinbarte Arbeitszeit beschäftigt werden; der Arbeitgeber will ihr deshalb #Minusstunden anrechnen. Ist das arbeitsrechtlich zulässig?,Twitter Web App,1,Bonn,,
1348685290639126530,11-01-2021,LordQuarantino,"Falls sich noch jemand fragt, wo die wichtigsten Prioritäten der Regierung liegen:""Der Tourismusbeauftragte [...] hat erklärt, dass Reisen wohl erst ab Pfingsten wieder problemlos möglich sein werden. Die Regierung erarbeitet gerade einen Stufenplan...""https://t.co/iP5CiGjkau",Twitter for Android,0,the sewers,,
1348685279553605638,11-01-2021,kiitxcaat,"Habe mittlerweile über 10 Bewerbungen versendet für ein Praktikum nächstes Semester und nur Absagen wegen, u.a. wegen Corona. Habe auch von weiteren Kommiliton*innen gehört, die deswegen nichts finden und der Uni ist das halt scheiß egal lol",Twitter for Android,0,wonderland,,
1348685239455895552,11-01-2021,manager_magazin,"Bitcoin, Corona-Impfstoff, Sensei Biotherapeutics - das war Montag, 11.1.2021 https://t.co/h2cSsnTVzJ",dlvr.it,0,"Hamburg, Deutschland",,
1348685232875184128,11-01-2021,CarloBanselotti,"Mittlerweile wäre ich bereit einen weiteren #lockdown von utopischen 8 Wochen über mich ergehen zu lassen, um danach etwas Hoffnung auf ein normales Leben wieder haben zu dürfen!@MpStephanWeil @GTonne Macht doch mal endlich das was Mutti sagt! #SchulenUndKitasZu #CoronaVirusDE",Twitter for Android,0,"Butjadingen, Deutschland",,
1348685228685086720,11-01-2021,Catsfriend0802,Ortsfremde blockieren Termine in Corona-Impfzentren https://t.co/wwFWVTzrjd,Twitter for Android,0,Aachen und Familie in NJ,,
1348685228559265798,11-01-2021,Stresstest16,"Weiss der wie es ist, wenn man einen Rheumaschub hat!? Was für ein dümmer Antirealist! Ich tausche gerne! https://t.co/vVOoDVuxh0",Twitter for Android,0,,,
1348685221366018048,11-01-2021,Liebhaberreisen,#Corona: eine Eindämmungsstrategie für ganz Europa… ... https://t.co/wXM9Fifu6K via @liebhaberreisende,Twitter Web App,0,Reise- & Gourmet- Reportagen ,,
1348685199283015681,11-01-2021,melly_maeh,"Realtalk:Bin jetzt auch hart am „Irgendwie ist alles zu viel“-Punkt angekommen. Assistenz zu viel. Selbstisolation zu viel. Corona zu viel. Menschen zu viel. Kommunikation zu viel. Was tun zu viel. Nix tun zu viel. ...Ugh, habe da keinen Bock drauf, macht das weg.",Twitter for iPhone,0,"Hürth, Gemany",,
1348685188231016451,11-01-2021,stefansengl,"Nachdem rund um Covid-19 und Impfthemen alle möglichen Verschwörungstheorien blühen, hier mal (ohne Anspruch auf Vollständigkeit) drei hoffentlich nützliche Tipps für Diskussionen mit Bekannten, die einem dazu mit seltsamen Ansichten überraschen:",Twitter for iPhone,4,"1050 Vienna, Austria",,
1348685164847763461,11-01-2021,Klartext_NE,"Kaarst - COVID-19: Aufschlüsselungen Daten 11.01.2021 - 7-Tages-Inzidenz-Wert,#Kaarst, #SARSCoV2, #Corona, #Aufschlüsselung, #Alter, #Wohnort, #Geschlecht, #Infektionen,https://t.co/YPHZyalkAC",Tweet Klartext-NE,0,Rhein-Kreis Neuss,,
1348685125542944770,11-01-2021,haunsteg,"Top story: Lockdown-Appell: Adidas, RWE, Vonovia, macht endlich eure Büros zu! - Finanzen - FOCUS Online https://t.co/kUD3wiKXKD, see more https://t.co/fWgeEo9Wxy",The Tweeted Times Mobile,0,,,
1348685124305625088,11-01-2021,DavidVickrey1,Empörung über »Judensterne« bei Impfgegner-Protest https://t.co/HLc97B3xaw via @derspiegel,Twitter for iPad,0,Maine USA,,
1348685093087408129,11-01-2021,rox712,"Wenn Jemand ständig ""Ich bin keine Corona-Leugnerin"" sagen muss.... Aber verstehen wie diese Infektionen verlaufen tun Sie auch nicht. Spuckschutzwände sind toll, scheren Aerosole aber einen Dreck. #NoFidK https://t.co/K8ErClZIw0",TweetDeck,0,Germany,,
1348685091556483078,11-01-2021,RohrmoserRainer,Palmer fordert LOCKDOWN https://t.co/U4tgOB0JeD REICHT JETZT.WIR MÜSSEN AUCH LEBEN.Vorsicht der Staat kesselt die ganze Menschheit ein.Die Kinder wollen in die Schule und Ihre Freiheit wieder.Freiheit Für ALLE.Der Forscher RR,Twitter Web App,0,Stuttgart,,
1348685072250101760,11-01-2021,Team_ReaIity,#Merz will Nutzer der #CoronaApp mit GPS orten.Warum überrascht mich das nicht?https://t.co/dUassZdhWW,Twitter Web App,6,"Schöneberg, Berlin",,
1348685049500213248,11-01-2021,SWPde_bot,#SWPPlus Corona in Deutschland: Zwei Corona-Mutationen bereiten Sorgen https://t.co/9vYZvDeAwf,SWPde_bot,0,"Ulm, Deutschland",,
1348685019074715668,11-01-2021,CovidAnalyser,Gewerkschaft Unia:«Angesichts von jetzt schon über 8'000 Corona-Toten in der Schweiz ist die Aktion ein Affront gegen die Menschlichkeit und den gesunden Menschenverstand.» -&gt; Schämt euch! Es stehen Existenzen auf dem Spiel bei den Wirten! #WirMachenAuf #corona #COVID19 #lockdown,Twitter for iPhone,0,,,
1348684962086711299,11-01-2021,SHGMichel,Toll geschrieben 👍#Corona_Versagen: Dreht die Politik jetzt durch? https://t.co/KY9w0iKZJg,Twitter Web App,0,"Hannover, Deutschland",,
1348684958085349378,11-01-2021,fzumw,"Was mich bei der #homeoffice Debatte stört, ist das immer so getan wird, als wäre es das Allheilmittel.Es ist halt nur ein Bruchteil der Jobs dafür geeignet. Der Rest muss trotzdem jeden Tag raus zur Arbeit. Corona hin oder her.",Twitter for Android,0,"Baden-Württemberg, Deutschland",,
1348684957531697155,11-01-2021,LIZ_de,"""Nicht gesellschaftsfähig"": Sandra Strauß und #Schwarwel haben im #Corona-Jahr ein Herzensprojekt zum Buch gemachthttps://t.co/mXSbDbZqI4#Buch #Rezension #Gesellschaft @GlueMo https://t.co/1fA825WCB8",Twitter Web App,1,Leipzig,,
1348684945942831106,11-01-2021,Ulfried2011,"Corona, die US-Wahl, große Katastrophen und kleinliche Streitereien - meistens war 2020 kein Spaß. Aber den gibt es dafür hier noch auf den letzten Metern: die Absurditäten des Jahres als Quiz mit 70 https://t.co/pu52osKIrG # via @SZMagazin",Twitter for iPad,0,Pullach,,
1348684911767674883,11-01-2021,BR24,"Der Druck auf die Unternehmen, ihre Mitarbeiter ins #HomeOffice zu schicken, wächst: Bayerns Ministerpräsident #Söder will sie zu zu konkreten Zielvorgaben drängen.https://t.co/HwyUHrecIo",TweetDeck,5,"München, Bayern",,
1348684858961371136,11-01-2021,deBaer,"Wenn sogar die Berliner Corona-Ampel, die von #r2g so konstruiert wurde, dass sie niemals rot zeigen kann, nur noch rot zeigt, weißt Du, dass die Kacke so richtig am Dampfen ist. Na, Scheeres, Mittwoch Schulöffnung? https://t.co/Qqey4aG1jR",TweetDeck,1,"Berlin, Germany",,
1348684854792216577,11-01-2021,volkerpabst,"#Orthodoxie und Corona: In kaum einem Land Europas ist der Einfluss der Kirche auf Gesellschaft und Politik grösser als in #Griechenland. Umso folgeschwerer, dass die Würdenträger im Umgang mit der Pandemie tief gespalten sind. Von Elena Panagiotidis @NZZ https://t.co/OsySc1PATU",Twitter for Android,0,Istanbul,,
1348684853852708873,11-01-2021,Klartext_NE,"Meerbusch - COVID-19: Aufschlüsselungen Daten 11.01.2021 - 7-Tages-Inzidenz-Wert,#Meerbusch, #SARSCoV2, #Corona, #Aufschlüsselung, #Alter, #Wohnort, #Geschlecht, #Infektionen,https://t.co/szBNIPQcUw",Tweet Klartext-NE,0,Rhein-Kreis Neuss,,
1348684843291467776,11-01-2021,Engel_Re,"Erinnert ihr euch an die verschiedenen Animationen zur Anfangszeit von Corona, die die Ansteckung bei R=1,x illustriert haben?Gibt es davon Updates, die die Impfrate + die Genesenen mit einbeziehen? Frage mich, ab wie viel % die Zahlen signifikant zurückgehen.",Twitter Web App,1,Berlin,,
1348684836307951620,11-01-2021,casanovacode,"Täglich lesen und hören wir in den Nachrichten, wie viele Covid-19 Neuinfektionen es gibt. Doch nun kommt der Schocker. ""Der PCR-Test kann keine Infektionen nachweisen."" - sagt eine Virologin und Immunologin: https://t.co/uiwR8aKiig #covid-19 #pcr-test#coronavirus #covid-positiv",SocialBee.io v2,0,"Isernhagen, Deutschland",,
1348684833199947780,11-01-2021,XAEA12pain,Da hab ich mein Leben vor Corona verbracht https://t.co/b5S0BtzlXN,Twitter for Android,0,,,
1348684827441176576,11-01-2021,TimRuster,"Jetzt ist der Spaß vorbei!Für hunderte Wissenschaftsvideos während langweiliger Corona-Tage abonniert hier meinen YouTube-Kanal und helft mir, mein Ziel von 40.000 Abonnenten zu knacken: https://t.co/YlYn7bluTx https://t.co/1oqKSzGWKs",Twitter Web App,1,"Cologne, Germany",,
1348684823561465857,11-01-2021,OngelTommy,Notbereuung in der Schule Tag 1. Bei Minusgraden und dauerhaft geöffnetem Fenster Hausaufgaben mit Jacke und Mütze machen. Manche Kinder hatten nur eine dünne Jacke und mussten sich durch herumlaufen erwärmen - auf Kosten der Hausaufgaben. Krass #COVID19 #Corona #Thueringen,Twitter for Android,0,,,
1348684823267844097,11-01-2021,schwooligan,"Wisst ihr noch damals, als bis Juni 2020 Mieter*innen geschützt davor waren aus ihren Wohnungen zu fliegen, wenn sie aufgrund der Krise ihre Miete nicht zahlen können? Jetzt ist Winter, die Corona-Situation viel dramatischer, ein zweiter Shutdown und es kann  gekündigt werden",Twitter Web App,7,er/he,,
1348684799112785920,11-01-2021,romansen1337,Erstmalig sind alle Corona-Ampeln in Berlin auf Rot. Aber weiß eigentlich irgendjemand ob und was das jetzt für Konsequenzen hat? Weiß das überhaupt die Gesundheitssenatorin?,Twitter Web App,1,"Berlin, Deutschland",,
1348684791701450760,11-01-2021,vroniixi,"Dann haben wir bald ein ganzes Schuljahr, was fast komplett für'n Arsch war. In NRW betrifft das 2,5 Millionen Schüler!Ein Unding!https://t.co/ZjE4gm3qxf",Twitter for Android,2,,,
1348684752992268295,11-01-2021,graf_edgar,So. Bin jetzt erst mal in Isolation/Quarantäne bis das Ergebnis vom Corona-Test meiner Freundin zurück kommt. https://t.co/GbCAbV2J13,Twitter for Android,0,,,
1348684738383519745,11-01-2021,ralph_sorge,"https://t.co/yIbEP0K7A6Und wird dann die Dunkelziffer Infektionen,geringer Werden ?Sind sie Sicher? Oder Ist der Verlauf ,so wie bei Keinen Lockdown! Mit Medizienischer Behandlung,bei Erkrankung!?Nur eine Frage?Ach ja,dazu müssten Sie aber alle Krankenhäuser wieder Öffnen,die",Twitter for Android,0,,,
1348684725792215041,11-01-2021,rosenbaumg0,"Eine 55-Jährige Frau mit Vorerkrankungen ist an Covid erkrankt. Fast 1100 von ca. 140.000 Einwohnern im Kreis Vechta wurden geimpft, das sind ca 0,8 Prozent. https://t.co/fyLIAAwKry",Twitter Web App,0,Bakum,,
1348684692757893122,11-01-2021,Sportbuzzer,Trotz 14 Ausfälle nach einem Corona-Fall: #Celtic Glasgow muss gegen #Hibernian antreten ➡️ https://t.co/3ANgzP7ejg https://t.co/SrPHgSMpYX,TweetDeck,0,,,
1348684691302445059,11-01-2021,noobischerefel,"ich mein, ganz ehrlich, ob ein lockdown nun 2 wochen oder 2 monate dauert: was meint ihr, was geschieht, wenn mal ende lockdown ist? trara.. richtig.. die infektionen gehen wieder hochweil langzeitkonzept? fehlanzeige",Twitter Web App,0,das wo ist unwichtig,,
1348684682129530880,11-01-2021,yousitonmyspot,"In etlichen Bezirken Österreichs ist die Inzidenz höher als der Schwellenwert Deutschlands, ab der ein Bewegungsradius von 15km festgelegt wurde (7-Tages-Inzidenz 200). Und wir reden ernsthaft über Lockerungen? Vergessts einfach bis März. Redet über echten Lockdown und Hilfen.",Twitter Web App,2,Vienna,,
1348684663330492418,11-01-2021,VTschirpke,Neue Dekadenz im Lockdown: weiter die Internetflat bezahlen,Twitter for iPhone,0,Bremen,,
1348684655906746369,11-01-2021,wenyi47830162,«Böse Folgen»: Alexander ist nach Corona-Infektion plötzlich unfruchtbar - 20 Minuten https://t.co/GcLMVIesGn,Twitter for iPad,0,,,
1348684646209486849,11-01-2021,RN_DORTMUND,RN+ Studie im Konzerthaus: Neues Corona-Konzept soll Konzerte wieder möglich machen https://t.co/mg6Ej1sERs,Echobox,1,Dortmund,,
1348684644082974727,11-01-2021,GPunishement,"Bis 31.03.21 ist es nicht ohne Weiteres möglich, nach #Oesterreich #at zu Reisen... hört man nirgends, muss man richtig suchen #Corona https://t.co/gP2WUfwant",Twitter for Android,0,,,
1348684642451410944,11-01-2021,wazwolfsburg,Corona-Hotspot – in Gifhorn gilt ab Dienstag eine nächtliche Ausgangssperre https://t.co/Bjo89WaKx5,Echobox,0,Wolfsburg,,
1348684639486009346,11-01-2021,U_Drolshagen,Kretschmer - Das war kein Besuchvia @sz https://t.co/l3cLXRErOQ,Twitter Web App,0,,,
1348684623618961411,11-01-2021,schlitterwicke,"Corona-Impfungen: Angstmache, Falschmeldungen und Gerüchte | https://t.co/JFv3zesx8e https://t.co/pkgNuDlv2m",Twitter for iPhone,0,Bonn,,
1348684563682308103,11-01-2021,Miss_Achtung,"Das war kein ""Besuch"", das war eine Drohung. Mein Kommentar zu den Corona-Leugnern, die gestern das Privathaus von Ministerpräsident #Kretschmer belagert haben.👇 https://t.co/0smFYNN4Fs",Twitter Web App,8,Mittlerer Osten,,
1348684556921171970,11-01-2021,kosmikanet,"Corona-Impfungen: Angstmache, Falschmeldungen und Gerüchte https://t.co/HO2fEOzPGt",Twitter for Android,0,"Germany, Deutschland / Hessen",,
1348684555977433090,11-01-2021,Klartext_NE,"Neuss - COVID-19: Aufschlüsselungen Daten 11.01.2021 - 7-Tages-Inzidenz-Wert,#Neuss, #SARSCoV2, #Coronainfektionen, #Aufschlüsselung, #Alter, #Wohnort, #Geschlecht, #Infektionen,https://t.co/SBzBVl1nMH",Tweet Klartext-NE,0,Rhein-Kreis Neuss,,
1348684537795125250,11-01-2021,sakamping,"Wenn Ihr Euch über das Impfen informieren wollt:BZgA (Bundeszentrale für gesundheitliche Aufklärung, die mit den lustigen STI-Kampagnen) https://t.co/r76ywwttWAOder hier https://t.co/oEA7LYB4b7 (auch in leichter Sprache bzw als Audio)#Impfen #ImpfenHilft #Corona #COVID19 1/",Twitter Web App,0,"Hamburg, Deutschland",,
1348684517721174018,11-01-2021,QueenQuinnchen,"Es ist #lockdown. Unsere Menschen sitzen allein zuhause, dürfen keine Freunde sehen. Alles anders. Also gibt es für meine Kraulerin zum Geburtstag dieses Jahr keine Torte, sondern sowas. Wer hätte mit alledem gerechnet? https://t.co/dYtSaOgD43",Twitter for iPhone,1,In horizontaler Lage,,
1348684511870136330,11-01-2021,LaElaoderSo,"Ich bin geimpft worden. Habe jetzt überall 5G und der dritte Arm, der mir aus dem A...h gewachsen ist hat sich als durchaus nützlich erwiesen #COVID19 #Corona #Covidioten #ichlassemichnichtimpfen #Impfung",Twitter for Android,0,Deutschland,,
1348684500151234560,11-01-2021,BremerhavenNew1,"Im Land Bremen müssen aktuell 167 Personen stationär versorgt werden, davon 32 auf Intensivstationen. Zwölf der intensivmedizinisch behandelten Personen müssen beatmet werden.https://t.co/KraMjthrXp https://t.co/QJpet1KJMX",Blog2Social APP,0,Bremerhaven,,
1348684458522796039,11-01-2021,AikProtech,Im Corona-Streit bleibt die Toleranz als erste auf der Strecke https://t.co/pC5tLN1112,Twitter Web App,0,"Berlin, Deutschland",,
1348684415094976513,11-01-2021,Clavelina18,Krampfanfälle nach Moderna-Impfung https://t.co/xG9AFiQOFE(Use-full-:8,Twitter for iPhone,0,Niederlande,,
1348684400133812227,11-01-2021,Anya_of_hogun,"Bin Teil des Corona-Test-Team am Embl in Heidelberg.Da mein Arbeitgeber aber als international eingestuft ist, bekomme ich keine meine Impfung wohl erst am Schluss.🎉🥂🍾*kotz*",Twitter for Android,0,"Schwetzingen, Deutschland",,
1348684373068034054,11-01-2021,pnp,Oberbayer wollte Chaletdorf im Berchtesgadner Land als „Klinik“ im Lockdown öffnen https://t.co/qfqkm7Pu5X,CleverPush,0,Passau,,
1348684346916540421,11-01-2021,saechsischeDE,"Mit der Aktion ""Wir machen aufmerksam"" verweisen Händler am Montag auf ihre Notlage. Von Corona-Leugnern distanzieren sich die Initiatoren der Aktion. #wirmachenaufmerksam#CoronaSN (SZ+) https://t.co/O8qO9CMHAG",TweetDeck,0,"ÜT: 51.056958,13.723433",,
1348684333918298113,11-01-2021,RehBln50,Im Corona-Streit bleibt die Toleranz als erste auf der Strecke https://t.co/HeNCP4OO1t ... In der Altersgruppe der über 90-Jährigen lag er am Montag aber bei 805 (!) und bei den 80-89-Jährigen bei 366. ‼️,Twitter Web App,0,,,
1348684332274241538,11-01-2021,Mehriel,#lockdown -Hilfen stocken: „Tausende Betriebe haben noch kein Geld gesehen“ https://t.co/FvD8pBoSMh,Twitter Web App,0,Deutschland,,
1348684306122743816,11-01-2021,Klartext_NE,"Grevenbroich - COVID-19: Aufschlüsselungen Daten 11.01.2021 - 7-Tages-Inzidenz-Wert,#Grevenbroich, #SARSCoV2, #Coronainfektionen, #Aufschlüsselung, #Alter, #Wohnort, #Geschlecht, #Infektionen,https://t.co/Me09HiWYkv",Tweet Klartext-NE,0,Rhein-Kreis Neuss,,
1348684283645489162,11-01-2021,draincess,3 corona tests hintereinander jetzt hab ich vor nix mehr angst wer will fetzen,Twitter for iPhone,0,she/they,,
1348684282584330241,11-01-2021,Sei_selbst,Die haben also völlig den Überblick verloren...Falls sie ihn je hatten.#Schulöffnungen #Coronaleine #lockdown #Grundrechte #BigPharma #Korruption #StayHome #TeamReality #Impfpflicht #Meinungsfreiheit #HomeOffice #Pressefreiheit #Propaganda #NieMehrCDU #coronavirus #WirMachenAuf https://t.co/N8cGrjU9gk,Twitter Web App,0,Deutschland,,
1348684273830780933,11-01-2021,pe_sutter,Grossbritannien in der Coronapandemie: Jahrelange Sparpolitik hinterlässt ihre Spuren... #corona @spschweiz @JusoSchweiz #SystemChange https://t.co/yqMUxu4Wrr,Twitter Web App,0,,,
1348684266461409282,11-01-2021,AminSharaf,Linzer Gastronomin öffnet im #Lockdown.#Covid #Coronahttps://t.co/eo17lv6RCx,Twitter for iPhone,0,"Wien, Österreich",,
1348684265005977600,11-01-2021,szaktuell,Zahlen vom Montag: Die Zahl der #Corona -Infektionen ist im #Saarland auf 22 405 bestätigte Fälle angestiegen. Das sind 58 Fälle mehr als am Vortag.https://t.co/NMCiK4n92m,TweetDeck,0,Saarbrücken,,
1348684260899762181,11-01-2021,Deutschland_77,"Heute war wieder ein total enttäuschender Tag bezüglich diesem #Corona. Erneut ist heute niemand gestorben. Wir sind weiterhin in #Kurzarbeit. Hoffentlich ist das neue #B117 nicht auch so ein Versager, wie sein aktueller Vorgänger.- Bestatter Adele, AltdorfJanuar 2021",Twitter for Android,4,#Schonlängerhierlebend,,
1348684229530447872,11-01-2021,RedRegionews,"Aktuelle Situation Covid-19 in OÖ (Stand 11. Jänner 2021, 15:00 Uhr) https://t.co/hnRIiQPXo0",dlvr.it,0,,,
1348684212610732033,11-01-2021,TinkaBeere,"Kurz durch die Timeline gescrollt. Zwei liebe Menschen gelesen: Eine wahnsinnig, weil in Quarantäne. Die andere fühlt sich mehr als nur nicht gut, weil Corona.Passt bitte auf euch auf! Ich will nicht noch mehr davon lesen ♥️🙏",Twitter Web App,0,"NRW, Deutschland",,
1348684154079227904,11-01-2021,nutzhirn,Streit um EU-Corona-Gelder in Italien: Zerreißprobe für Regierung https://t.co/UhmPUAAOkC,WordPress.com,0,Wiener Neustadt,,
1348684126673657861,11-01-2021,ein_prozent,In der ersten Folge der #Lagebesprechung (@lagepodcast) im neuen Jahr spricht Moderator @_JonasSchick über die kopflose Politik in der #Coronakrise.Hier reinhören: https://t.co/dkU8yY7DCK1/3#Podcast #Corona #Lockdown #Ausgangssperren https://t.co/WsyjzH9I0D,Twitter Web App,1,,,
1348684112996032512,11-01-2021,StZ_NEWS,Spendenaktion in Stuttgart: Essenspende für Intensivpfleger auf Covid-19-Station https://t.co/UVCVCevdU2,Echobox,0,"Stuttgart, Germany",,
1348684096088780803,11-01-2021,JuBeeMG,"Eigenverantwortung, das Einzige was neben Reißverschluss-Verfahren und freiwillige Selbstkontrolle bei uns funktioniert. Reiserückkehrer aus einen Risikogebiet müssen sich online registrieren und zwingend einen Corona-Test machen und dann 14 Tage in Quarantäne. Kontrolle? Nö!",Twitter for Android,0,Bei den Mönchen am Glanzbach,,
1348684083686215681,11-01-2021,d_avantgarde,Erster Tag ist rum. Unterm Strich lief es okay. #lockdown,Twitter Web App,0,Berlin,,
1348684046805643269,11-01-2021,Thommy_Saxony,"#Corona #CSU #StasiJetzt glänzt schon die CSU mit Stasi Methoden, um den Bürger zu überwachen. Bisher hatte ich eher bei der #Linke mit sowas gerechnet. https://t.co/tKGrWxzfgP",Twitter for Android,2,"Dresden, Sachsen",,
1348684040497491974,11-01-2021,Schwerimlot,"Wann sagen die Damen und Herren Bundesräte endlich, dass Sie masslos versagt haben? Fertig mit all den Lügen!!! @Bundesrat_CH @BAG_OFSP_UFSP #coronavirus #lockdown «Schweiz ist mit Impfstrategie sehr gut positioniert» https://t.co/uyFdOJTIS6",Twitter for Android,0,☆Monopolitanien☆,,
1348684024730980353,11-01-2021,ExFaaf,Urlaub! Urlaub! Urlaub!Was wollen wir? URLAUB!Wann wollen wir ihn? JETZT!Wird er bezahlt sein? JA!Wie lange wird er dauern? ZWEI WOCHEN!!#COVID19 #Gesundheit #lockdown,Twitter for Android,0,Deutschland,,
1348684023044849665,11-01-2021,111publishing,Einzelhändler protestieren gegen Schließung https://t.co/QUYi4n7UnZ.,Twitter Web App,0,North America,,
1348684010638225409,11-01-2021,platinalbaner,Menschen heulen rum weil sie sich wegen Lockdown eingeengt fühlen aber sperren Tiere im Zoo Jahrelang ein...,Twitter for iPhone,0,,,
1348683979940048896,11-01-2021,Klartext_NE,"Dormagen - COVID-19: Aufschlüsselungen Daten 11.01.2021 - 7-Tages-Inzidenz-Wert,#Dormagen, #SARSCoV2, #Coronainfektionen, #Aufschlüsselung, #Alter, #Wohnort, #Geschlecht, #Infektionen,https://t.co/doFWVquq76",Tweet Klartext-NE,0,Rhein-Kreis Neuss,,
1348683952802979846,11-01-2021,muldental_jl,... Lockdown? Nicht mit mir!,Twitter for Android,0,Bad Lausick,,
1348683944645033984,11-01-2021,grinsepix,Fast ein Jahr #corona #Pandemie und der digitale Unterricht an der #Schule meiner Kinder beschränkt sich noch immer darauf Arbeitsblätter per Mail zu verschicken. #DigitaleBildung,Twitter for iPhone,0,,,
1348683923811938306,11-01-2021,kenjebsen_real,Wenn ausgerechnet Klinik-Personal sich NICHT mit einen kaum getesteten Medikament impfen lassen will sollte das nachdenklich machen!  https://t.co/6lYGTRbdTh https://t.co/CNssjVOgRm,IFTTT,0,,,
1348683903700185090,11-01-2021,Marion_Nur,"Wenn #nomerz Kanzler wird, wird #Palmer dann Vizekanzler? Frage nur mal so...https://t.co/CyFyVqrwVq",Twitter for Android,0,,,
1348683893373874176,11-01-2021,DieTagespost,"Coronavirus: China blockiert eine Delegation der WHOWie der Figaro berichtet, taucht die These, das COVID 19-Virus entstamme einem Labor in Wuhan, erneut auf. Doch ein WHO-Untersuchungsteam erhält von der chinesischen Regierung keine Visa.https://t.co/AgvSM9pctC https://t.co/dYoUzRsTAY",IFTTT,1,,,
1348683864114401280,11-01-2021,marcusreif,Morgen erster Blog-Beitrag. Habe über meinen Urlaub Artikel bis April fertig und geplant. Das war eine kreative Zeit im Lockdown. Viel Spaß auf https://t.co/6EUfJdRBM5 https://t.co/97v4BLShuR,Twitter Web App,0,Flörsheim am Main,,
1348683847710466049,11-01-2021,fwilhelm,"#COVID19 im #Saarland : 2088 Aktive Infektionen, das sind 92 Stück oder 4.4% weniger als am Vortag. Die Prognoselücke schien so um die 400 gewesen zu sein. Und Übermitteln der Zahlen zum RKI scheint schwierig zu sein",Twitter for iPhone,0,"Saarbrücken, Germany",,
1348683841733603333,11-01-2021,HWillaredt,"Dieser Lockdown ist gesellschaftsschädigend. Die negativen wirtschaftlichen und sozialen Folgen interessieren die Verantwortlichen nicht, da sie selbst davon nicht betroffen sind und keinen Blick für das Gesamte haben. Management mit Scheuklappen.",Twitter Web App,1,"Basel-City, Switzerland",,
1348683821387026435,11-01-2021,ThomasHetting10,Heute in Hochform:„Die richtigen Fragen“: Müssen wir uns auf Lockdown bis März einstellen? - News - https://t.co/5vGFj3ZvRN https://t.co/vA0vCNTLfh,Twitter Web App,0,"Nürtingen, Deutschland",,
1348683819919015939,11-01-2021,tzmuenchen,Dramatische Corona-Lage in Münchner Kliniken: „Die Woche der Wahrheit hat begonnen“https://t.co/VqxVJQoW5c,TweetDeck,5,München,,
1348683810985168897,11-01-2021,MSF_austria,"1⃣💲 für das Patent auf ein lebensrettendes Medikament. Damit wirklich alle, die es brauchen, es auch bekommen. Wir wären glücklich, wenn dieser Spirit in der #COVID19 #Pandemie wiederentdeckt und kultiviert werden würde. #NoPatentsInAPandemic #LivesOverProfits https://t.co/OYEaM7BBLO",Twitter Web App,2,Österreich,,
1348683798418960385,11-01-2021,LehmannsHD,"Da eröffnet einer einen Comic-Laden während Corona. Tolle Sache, das Konzept klingt spannend und wir wünschen viel Erfolg! https://t.co/rgGEakLrQy",Twitter Web App,0,"Heidelberg, Deutschland",,
1348683788776308738,11-01-2021,Echo_Online,"Es hat sie am Samstag nicht gegeben, die 22 Opfer in einer Groß-Zimmerner Pflegeeinrichtung. Wie es sein kann, dass das Gesundheitsamt sie trotzdem meldet. #corona #darmstadtdieburg #gesundheitsamt https://t.co/dxoowhoYJh",CleverPush,0,Darmstadt,,
1348683780584857603,11-01-2021,drews_erika,"Nur 1 König ist gekommen, wegen Corona keine Einreisegenehmigung? https://t.co/LC7Bq3XdGJ",Twitter for Android,0,,,
1348683757553856515,11-01-2021,FR_Hessen,"Von wegen nur schwere Straftäter werden aus #Hessen nach #Afghanistan abgeschoben! Morgen soll es einen jungen Mann in Ausbildung und mit Familie treffen, der zu einer Bewährunsstrafe verurteilt wurde. Kurz vor Ende der Berwährunszeit und trotz #Corona. https://t.co/kuSpfyMmB4",Twitter for Android,1,"Hesse, Germany",,
