tweet_id,date,username,tweet,source,retweet_count,user_location,user_place,coordinates
1352281756083363840,21-01-2021,ChBaars,"Einige, v.a. ärmere Länder fordern ein Aussetzen der Patente auf #Corona-#Impfstoffe, damit auch andere Firmen sie herstellen können. Unterstützt werden sie z.B. von @msf_de  Debatte dazu läuft auch in der WTO. Jedoch lehnen die meisten reichen Länder ein Aussetzen ab. https://t.co/UURNlVefNa",Twitter for Mac,4,,,
1352281748848193536,21-01-2021,rbb24,#Brandenburg verlängert den Lockdown bis 14. Februar. Alle weiteren #Corona-Beschlüsse und Informationen zu Schulen und Kitas finden Sie hier 👉 https://t.co/Nl5QwjJOZ0 https://t.co/DPTq9QBtuL,Twitter Web App,7,Berlin & Brandenburg,,
1352281715889287168,21-01-2021,wznewsline,Corona: Kein Impfstoff für Wülfrather Altenheime lieferbar https://t.co/LYMshaFVcl https://t.co/rX9k2mWJsu,Echobox,0,"Düsseldorf, Wuppertal, Krefeld",,
1352281715310518273,21-01-2021,BILD_Koeln,CORONA-SCHULJAHR - NRW hält an Abschlussprüfungen fest https://t.co/P1zzuzU8yn #Koeln #Nachrichten,Zapier.com,0,Köln,,
1352281684079751168,21-01-2021,allaroundscorer,"Lockdown Beschäftigung erstmal gesichert.Basketball schauen, exzessiv kochen und bisschen lesen 😍 https://t.co/pb3Fe7gqYh",Twitter for Android,0,Kurz hinterm Logo,,
1352281654321156096,21-01-2021,HVSchmitzvS,..mit langfristigen Auswirkungen auf unser #Einkaufsverhalten und die Attraktivität unserer #InnenstädteSchlecht durchdachte Corona-Maßnahmen zerstören #Handel und #Gastronomie - https://t.co/HYleZFfJEj,Twitter for Android,0,"Koblenz, Deutschland",,
1352281648910495744,21-01-2021,PlayEXP,"In Zeiten von Corona, #HomeOffice und #Gaming kann das Internet schon mal sehr langsam werden. Mit dem @Netgear_de  bestimmt jeder selber, wie es daheim verteilt wir und wie direkt die Leitung zum Server ist.#gaming #game #gamer #playstation5 #playexperience #wifi6 https://t.co/O8OytKpXr6",Twitter Web App,0,"Blaubeuren, Deutschland",,
1352281602852851713,21-01-2021,hacker_fdp,"Gemeinsam mit Landrat Florian Wiedermann habe ich mir heute das #Impfzentrum in der Kepler-Realschule #Bayreuth angeschaut. Außer genug Impfstoff ist alles da und bestens vorbereitet. Danke an landratsamt, @brkaktuell und @malteserDE! (TH) @inFranken https://t.co/ceGAPmpUEM",Twitter for iPad,0,Bayreuth,,
1352281601095458816,21-01-2021,Meenzer721,An Herrn Söder :Dann ist der Impfpass für'n Arsch!!!!Geimpfte Menschen sind laut Immunologe wohl doch ansteckendhttps://t.co/1Ij3fKXJjx--Empfohlen von WELT News für Androidhttps://t.co/kijB7Wx1KJ,Twitter for Android,2,"Mainz, Deutschland",,
1352281600797638661,21-01-2021,RoselS19,„In Frankreich haben fünf ungeklärte Todesfälle die Debatte über mögliche Risiken des Impfstoffs von Pfizer und Biontech angeheizt. Der französische Gesundheitsminister Olivier Véran hat Untersuchungen angekündigthttps://t.co/Mip74A3sB1 https://t.co/txXNooE5ZU https://t.co/XgXPETdtjt,Twitter for iPad,22,"Sachsen, Deutschland",,
1352281584242728962,21-01-2021,Dr_Kakerlake,"Nicht nur da. Überall. War die inkompetenteste Admin ever. Absolut nichts richtig gemacht. Ausser das Stärken von rechtsradikalen Strukturen. Dass unsere rechten Schreibsoldaten, die das Selbe tun, die gut fanden wundert nicht. https://t.co/iUG4nZunkL",Twitter Web App,0,3rd rock from the sun,,
1352281574885257219,21-01-2021,pianolisko,Zum #Homeoffice: Die Prozentzahl die erreicht werden muss entspricht auch der Prozentzahl die man geimpft haben muss. Heißt also man muss die 60+% erreichen und dann so lange aufrechterhalten bis auch 60+% der Bevölkerung geimpft sind. #HomeofficePflicht #COVID19de #COVID19,Twitter Web App,0,Chemnitz/Kontiolahti,,
1352281570128834562,21-01-2021,BR24,🧬 In der @ChariteBerlin zeigte sich: Die #Corona-#Mutation ist nicht völlig unbekannt. Experten rechnen deshalb aktuell nicht mit gravierenden Auswirkungen. 🔬 #garmischpartenkirchen https://t.co/mP5imm1Rvj,Twitter Web App,3,"München, Bayern",,
1352281566857338882,21-01-2021,AZ_Augsburg,"Die Versorgung mit dem Corona-#Impfstoff ist dürftig, nun wird sie noch schlechter. Bund und Länder haben Fehler gemacht, die jetzt immer klarer werden. Ein Kommentar von @Grimm_Christian. https://t.co/vwEJt7K51E",Twitter Web App,1,Augsburg,,
1352281563761958913,21-01-2021,Roche_de,"In Dtl werden jährlich 4.400 Frauen mit #Gebärmutterhalskrebs diagnostiziert – 1.500 sterben daran. Frühzeitig erkannt, lässt sich die Krankheit gut behandeln. Deshalb ist es wichtig, regelmäßige zur Vorsorgeuntersuchung zu gehen, auch in Zeiten von COVID-19 #CervicalHealthMonth https://t.co/hCRLQscDx1",Sprout Social,0,Deutschland,,
1352281558179262467,21-01-2021,academies_ch,"🔈Haben Sie Fragen zu #Impfungen? @V_Masserey, Marcel Tanner und @JakobZinsstag beantworten Ihre Fragen nächsten Dienstag, 26. Januar ab 18:15 im #Covid19Forum. https://t.co/4kHMxTEX97@SATW_ch @scnatCH @SAGW_CH @ScienceEtCite @BAG_OFSP_UFSP @unil @SwissTPH @ForumGenetic_CH https://t.co/0vaXf6wyjM",Twitter Web App,0,"Bern, Schweiz",,
1352281550709272581,21-01-2021,Geerthe1,"Bestatter redet Tacheles: wo Corona drauf steht, ist oft nicht Corona drin - 2020 NEWS https://t.co/cCO4uzlGQU",Twitter for iPhone,0,Deutschland,,
1352281499719118848,21-01-2021,kkklawitter,"„Es ist Aufgabe der Politik, Voraussetzungen für eine nachhaltige Entwicklung der Wirtschaft zu schaffen, damit es Menschen gut geht. Nicht andersherum! Es ist nicht unser Job,Unternehmen alles recht zu machen,egal wie sie mit ihren Beschäftigten umgehen.“ https://t.co/NtgbNlU1g7",Twitter for iPhone,0,"Hamburg, Deutschland",,
1352281497898774529,21-01-2021,Bertmwalther,Brandenburg: Erzwungener Personalmangel sorgt für Stop...https://t.co/NnX7EVX5KW,Twitter Web App,1,"Vogtlandkreis, Sachsen",,
1352281495587737602,21-01-2021,SamstagBlog,"Der Corona-Impfrechner ist eine tolle Sache! Jetzt weiß ich, dass 37 Millionen vor mir dran sind. Das ist ja überschaubar!",Twitter Web App,0,"Berlin, Germany",,
1352281464042369024,21-01-2021,Baufi24,"Wow, was für ein Jahr. Wir konnten in 2020 trotz aller erschwerten Bedingungen durch Corona unser abgeschlossenes Finanzierungsvolumen um 110 Prozent steigern, das Umsatzwachstum betrug 96 Prozent. Die Anzahl unserer Mitarbeiter*innen konnten wir fast vervierfachen! Weiter so!",Twitter Web App,0,Hamburg,,
1352281461567709185,21-01-2021,3EuroDueruem,Kannst du mal mein lockdown verhärten,Twitter for Android,0,wandsbek,,
1352281380911255554,21-01-2021,wortschwert,"#Strunz dumm zu finden, ist einfach. Ihn zu widerlegen, ist es nicht. Rechnerisch wird der letzte Deutsche in 4 Jahren seine ERSTE(!) Impfung bekommen. WENN alles nach #Merkel - Plan läuft, was es jetzt schon nicht tut. Bis dahin jährlich von Okt. bis April #Lockdown?",Twitter Web App,0,,,
1352281363362287617,21-01-2021,norbertbayer,"«Florian Havemann ist ein Charakter von femininer Sensibilität, humorbegabt, luftgängerisch frei. Sein Leben nennt er völlig zersplittert. Seine Selbstbezeichnungen lauten: Künstler, Staatsbürger, furchtbar begabter Mensch.» https://t.co/iOzItxL8wY via @zeitonline",Twitter Web App,0,Berlin,,
1352281362909323270,21-01-2021,KRandegg,Die Bücherei bleit bis auf weiteres aufgrund der Corona-Verordnung des Landes Baden-Württemberg geschlossen.,Twitter Web App,0,"Gottmadingen, Deutschland",,
1352281362112376835,21-01-2021,rosi_lux,"„Am Ende gilt die alte Wahrheit, dass jede Zeit ihre eigenen Figuren hervorbringt. Wer hätte vor fünfzehn Jahren gedacht, dass Angela Merkel, Pfarrerstochter aus Vorpommern, eine ganze Ära prägen würde? https://t.co/89ZI4t3i5K",Twitter for iPad,0,Deutschland,,
1352281349424558082,21-01-2021,srfnews,Eine neue Studie aus #Südafrika warnt: Auch Menschen mit durchgemachter #Covid19-Infektion könnten angesteckt werden. https://t.co/n6g3WEWOYY,Twitter Web App,4,Switzerland,,
1352281327807168515,21-01-2021,zeitonline_pol,Emotionen sind nicht so ihr Kerngeschäft: Über den Auftritt von Angela Merkel in der Bundespressekonferenz zum #Corona-Lockdown https://t.co/ainTOlAwr4,ZEITonline,1,"Berlin, Deutschland",,
1352281325881982978,21-01-2021,zeitonline,Lässt sich #Merkel nur von #Lockdown-Hardlinern beraten? Versteht sie die Sorgen der Eltern? Die Kanzlerin war heute in der Bundespressekonferenz. https://t.co/vA8C9SxiN2,ZEITonline,6,"Berlin und Hamburg, Germany",,
1352281309662617603,21-01-2021,klatsch_tratsch,Legendäres Glastonbury-Festival erneut abgesagt #2021 #Corona #festival #Glastonbury #musik #Pandemiehttps://t.co/zwWSWBsxtL,klatsch-tratsch.de,0,Germany,,
1352281306391060480,21-01-2021,bt_tagblatt,So viele Corona-Verstöße gab es bisher in Bayreuth https://t.co/1ZrCs7GcaT,CleverPush,0,Bayreuth,,
1352281304948240385,21-01-2021,blaetter,"»Blätter«-Herausgeber Rudolf Hickel unterstützt #ZeroCovid https://t.co/sBInOkNncH:»Wenn wir es nicht probieren, dann wursteln wir uns weiter durch wie bislang – und das macht das Land nicht nur sozial und ökonomisch, sondern auch moralisch kaputt.«https://t.co/A78lBrUJOw https://t.co/UggLwcvK1i",Buffer,2,Berlin,,
1352281303492780039,21-01-2021,DerAufklrer,Richter rechnet mit dem Lockdown und der Corona-Politik ab https://t.co/FjxMo92ypL via @tichyseinblick,Twitter Web App,1,Texas USA,,
1352281265760841737,21-01-2021,derspiegel,Angela Merkel macht Familien Hoffnung: Bildungseinrichtungen haben laut der Kanzlerin bei der Wiedereröffnung Priorität. https://t.co/pUct2ol1ZS,TweetDeck,3,"Hamburg, Germany",,
1352281255996489731,21-01-2021,pleitier,Belgischer Regierungschef fordert EU-weites Verbot von Urlaubsreisen https://t.co/Cjd2RUiCiX,Twitter for iPhone,0,Großherzogtum Baden,,
1352281249751191552,21-01-2021,honigsuess,"Wie sehr die österreichische Regierung in der Corona-Sache versagt, zeigt sich in der steigenden Zahl in GB. Manfred sieht die großen Zusammenhänge.",Twitter for iPhone,0,Österreich,,
1352281225105440774,21-01-2021,Rambling_Rocks,"#MuseumSelfieDay - hab ich wohl verpasst. Na gut, Dank Corona kommt man ja eh in kein Museum. Dennoch sind es wichtige Institutionen. In meiner Stadt gibt es ein großes Kunstmuseum. Zurzeit ist dort eine Ausstellung, die ich gerne sehen würde, aber naja Corona macht es unmöglich https://t.co/Dz7tSEhI9u",Twitter for Android,1,"Schwerin, Deutschland",,
1352281210068856832,21-01-2021,HeitmannStephan,"Aber Corona-Maßnahmenkritiker die das seit Monaten sagen, waren Covidioten! Die Wahrheit ist eine Schnecke.Corona-Todesfälle: „Die Zahlen des RKI sind unbrauchbar“ https://t.co/hGBEUKwsrh via @welt",Twitter Web App,0,Schönste Stadt am Rhein,,
1352281205144743938,21-01-2021,stephiestockki,Danke für diesen Text. Ich lege mich jetzt auf den Boden und starre an die Decke!Die seelischen Folgen der Corona-Pandemie für Familien - SZ Magazin https://t.co/D19gMpZeuz,Twitter for iPhone,0,"Berlin, Deutschland",,
1352281201025798146,21-01-2021,ErichAschi,Die Konzerninitiative wäre auch ohne Corona gescheitert https://t.co/As4BTAsCIq via @NZZ,Twitter Web App,2,Zürich,,
1352281192964509699,21-01-2021,RND_de,"""Es braucht jetzt Vorbilder, es braucht Warmherzigkeit, es braucht Einfühlungsvermögen für all jene, die am meisten unter dieser Krise leiden"",  kommentiert @WaltrautDunz. #Coronakrise #COVID19 https://t.co/HJZTVCbErT",TweetDeck,2,Hannover,,
1352281182751268864,21-01-2021,Dt_Aerzteblatt,G-BA verlängert Coronasonderregeln bis Ende März:  Berlin – Der Gemeinsame Bundesausschuss (G-BA) hat heute die geltenden Corona-Sonderregeln für ärztlich verordnete Leistungen um weitere zwei Monate bis 31. März 2021 verlängert. Die… https://t.co/wLUnXgfFo3 #COVID19 https://t.co/Tk4gHD4DI3,dlvr.it,2,Germany,,
1352281179332886529,21-01-2021,KreisCoesfeld,27 neue Covid-19-Infektionen im Kreis Coesfeld https://t.co/zShYMo7g6h,dlvr.it,0,"Coesfeld, Nordrhein-Westfalen",,
1352281164556488704,21-01-2021,StephanEwald,Ich und die diversen #CoronaVirus #Lockdown Regeln … https://t.co/pJoqLV85ft,Twitter for Android,0,Vienna,,
1352281134118412294,21-01-2021,abendblatt,Stiftung: Corona-Todesfälle durch Sepsis oft zu verhindern https://t.co/hRIW8ZsalP https://t.co/Zf6UIhdFKG,Echobox,0,Hamburg,,
1352281131043991552,21-01-2021,_AlphaGoat_,"Da werden so manche SoziologInnen ganz feucht im Hoserl, wenn das kommunistische #China scheinbar die #Pandemie so super meistert und immer so viel Wirtschaftswachstum hat und sowieso alle Leute so gut im Griff hat :*)#COVID19 https://t.co/BUK8V0vDcG",Twitter Web App,0,Österreich,,
1352281113339826177,21-01-2021,Donegal72,"Ich weiß, sowas ist immer anekdotisch. Aber der Arbeitgeber aus dem Öffentlichen Dienst, der meiner Bekannten gerade erklärt sie müsse nächste Woche 450 km fahren um Büroarbeit vor Ort zu machen statt im #HomeOffice... Läuft mit dem Aufruf an die Arbeitgeber. #Corona #lockdown",Twitter Web App,0,"Karlsruhe, Deutschland",,
1352281104661819396,21-01-2021,Paulinelliott,Mehrsprachiges Infomaterial zum #COVID19 #Impfstoff vom @rki_de:https://t.co/jSdOIgJdNJ,Twitter for Android,0,Germany,,
1352281094561914880,21-01-2021,FCB_Snipz,Es ist so langweilig 😖 @Corona du Hund verpiss dich,Twitter for Android,0,,,
1352281094419308544,21-01-2021,kibitz1111,"Tut mir sehr leid meine lieben Zwitschgis. Stelle fest, bin seit Corona ein schlechter Unterhalter. Kaum Tweets. Wenn ich nicht auf Reisen gehen, oder Freunde einladen kann, dann bin ich langweilig 🙈",Twitter for Android,0,Schweiz,"Place(_api=<tweepy.api.API object at 0x000002ADEFC90040>, id='801d695679da4a3a', url='https://api.twitter.com/1.1/geo/id/801d695679da4a3a.json', place_type='city', name='Köniz', full_name='Köniz, Schweiz', country_code='CH', country='Switzerland', contained_within=[], bounding_box=BoundingBox(_api=<tweepy.api.API object at 0x000002ADEFC90040>, type='Polygon', coordinates=[[[7.331021, 46.860612], [7.471281, 46.860612], [7.471281, 46.9368029], [7.331021, 46.9368029]]]), attributes={})",
1352281086454337539,21-01-2021,Tag24S,Verfassungsschutz sieht sich bei #Querdenken-Beobachtung bestätigt. #querdenken711 #corona #protest https://t.co/VK59eJ39C2 https://t.co/Ea0YEUKUVI,Tag24,0,"Stuttgart, Theo 8",,
1352281084860444672,21-01-2021,ShortKickz,Er hat jetzt schon mehr gemacht als Trump in der ganzen Zeit gegen Corona gefühlt 😹 https://t.co/WrLQZhDwBi,Twitter for Android,0,"Hamburg, Deutschland",,
1352281074001469448,21-01-2021,westermann_news,"Sport nach einer Covid-19-Infektion? Welche langfristigen Folgen eine Covid-19-Erkrankung haben kann und was Sportler nach überstandener beachten sollten, darüber informiert dieses #Arbeitsblatt. #Biologie #Sport ab Klasse 9 https://t.co/UCfBkCmMpW #twlz https://t.co/Og9asjJ3RG",Hootsuite Inc.,1,"Braunschweig, Deutschland",,
1352281059581452291,21-01-2021,M12010111,"Hat die ""Mutter der europ. Lösung"" eigentlich bedacht, dass unsere Nachbarn (bei in der Regel höheren Zahlen) keinen Super-Mega-Lockdown-Zirkus veranstalten?Besteht in diesem Fall kein Bedarf zur Absprache? Oder gibt es die europ. Lösung nur, wenn es D schaden soll?#Merkel",Twitter Web App,0,,,
1352281046486712321,21-01-2021,WAZ_Redaktion,"#Oberhausen Olé findet, falls es die #Corona-Pandemie zulässt, in diesem Jahr ohne Michael #Wendler statt.https://t.co/MZfXb7RyRk",TweetDeck,3,Essen,,
1352281046239350784,21-01-2021,tzmuenchen,"Lebensbedrohlich ist #SARSCoV2 besonders in Alten- und Pflegeheimen. Es gibt immer wieder Fälle, wo eine #Impfung von #Risikopatienten zu spät durchgeführt wurde.#Pflege #CoronaVirusDE #Covid19 #todesfällehttps://t.co/d7ZG4TwsRT",TweetDeck,3,München,,
1352281046205788163,21-01-2021,merkur_de,"Lebensbedrohlich ist #SARSCoV2 besonders in Alten- und Pflegeheimen. Es gibt immer wieder Fälle, wo eine #Impfung von #Risikopatienten zu spät durchgeführt wurde.#Pflege #CoronaVirusDE #Covid19 #todesfällehttps://t.co/ds6AvjrDDB",TweetDeck,1,"München, Oberbayern",,
1352281029449539584,21-01-2021,tobiaskloes,"Vergesst nicht die, die jetzt im Lockdown alleine sind, weil sie keine Menschen in ihrem Haushalt haben. #corona",Twitter Web App,0,Marburg,,
1352281022998716418,21-01-2021,rutishau,Südafrikanischer Milliardär fliegt in die Schweiz zur Corona-Impfung https://t.co/JDy5DO5vut,Twitter for iPhone,0,Switzerland,,
1352280994485776384,21-01-2021,lokalkompass_de,"Unser Kollege ist schon gegen Covid-19 geimpft. Wie es dazu kam und wie es ihm jetzt geht, lest ihr hier.  https://t.co/w9H8Phpwxd",Echobox,0,Essen,,
1352280963640864768,21-01-2021,jelushmelush,an der arbeit meinte letztens eine corona ist so schlimm bei uns weil die deutschen einfach nicht konsequent sind aber die trägt keine maske an der arbeit und war vor lockdown nur unterwegs und in shisha bars bitte hör auf zu reden und zu denken😭😭😭😭😭,Twitter for iPhone,0,"Hessen, Deutschland",,
1352280962747527169,21-01-2021,Meenzer721,Wenn wir nicht brav sind und uns nicht impfen lassen dann wird das vielleichtpassieren als Druckmittel...GAU Grenzschließung – „Wir würden in Versorgungsengpässe hineinlaufen“https://t.co/gptqIYhcDP--Empfohlen von WELT News für Androidhttps://t.co/kijB7Wx1KJ,Twitter for Android,0,"Mainz, Deutschland",,
1352280945970343936,21-01-2021,ConstanzeG1,#Brandenburg #Sonderweg #CoronaDie Zahlen in Brandenburg gehen nicht schnell genug runter. Trotzdem bleiben Kitas offen und Abschlussklassen müssen in die Schulen. Das Ziel ist die Inzidenz &lt; 50 Mitte Februar. @UNonnemacher : ist das erreichbar? https://t.co/aCyOrySI0E,Twitter for Android,0,Potsdam,,
1352280935190900738,21-01-2021,mortalhope1,#Corona-Spaziergang. https://t.co/ZG5ODsfk9t,Twitter for Android,1,,,
1352280928937267203,21-01-2021,Mr_RoAn_GC,"""schulausfall ist nicht so schlimm""https://t.co/45to4sbdko",Twitter for Android,0,nordkurve hannover,,
1352280912185143300,21-01-2021,norman_dus,"Krass.Dieses Corona-Gedöns gibts schon über ein Jahr. Ich weiß noch, wie ich im Jan 20 beim Team-Meeting im jugendlichen Leichtsinn „Wird alles nur gehyped &amp; ist doch nur wie ne Grippe.“ gesagt hab.Ich wurde eines besseren Belehrt. Aber ich hab gelernt und bin zurückhaltender. https://t.co/9oaKTG7wb2",Twitter for iPhone,0,RHEINLAND,,
1352280901531656192,21-01-2021,rosi_lux,"„Parteichef Habeck ist der Hohepriester dieses sanften grünen New Age, ein freundlicher Warner und Mahner, dessen Polit-Poesie zuweilen rätselhaft klingt, dafür aber ein gutes Gefühl vermittelt – https://t.co/89ZI4t3i5K",Twitter for iPad,0,Deutschland,,
1352280896561414146,21-01-2021,aengelhorn,"Ich halte das für Blödsinn, dass sich ein halbes Jahr Homeschooling für meine Kinder im Alter von 10 und 12 auf deren berufliches Einkommen auswirken wird und man das so linear auf eine Volkswirtschaft hochrechnen kann. #schule #corona #ifo #schulausfall https://t.co/eSazBKdW16",Twitter Web App,0,"Meißen, Saxony, Germany",,
1352280842362646528,21-01-2021,svmatis,"Die Betriebsstelle ist nicht arbeitsfähig, die Hälfte der Belegschaft fehlt. Entweder durch eine #Corona-Infektion, Quarantäne oder andere Krankheiten. Alle anderen wurden getestet, um eine Ausbreitung einzudämmen.PS. Papier ist geduldig. https://t.co/qdyK5Crwdi",Twitter Web App,1,Stuttgart - Rathaus,,
1352280823915978754,21-01-2021,Deutschland_BRD,GAU Grenzschließung – „Wir würden in Versorgungsengpässe hineinlaufen“ https://t.co/8BbtsScDPN https://t.co/A1uLKhj3G9,dlvr.it,0,Deutschland - Germany,,
1352280813887492098,21-01-2021,hendrik_weber,"Oh, ich weiß, ich weiß!!! Dann jetzt SCHNELL die Schulen wieder aufmachen!?!?!! Oder...? #kmk #präsenzprimatstinks #bildungabersicher  https://t.co/LReg1mt1sq",Twitter for iPhone,0,"Hamburg, Deutschland",,
1352280728642453506,21-01-2021,IsabelVillalon1,"Dr. Nachman Ash, Verantwortlicher der #Covid19 Impfaktion in #Israel warnt, der Schutz nach der ersten #Pfizer #Impfung ist weitaus geringer als erwartet. Erst zwei Impfungen sollten 95% Schutz gewähren. Viele Infizierte nach 1. Impfung.https://t.co/I1R7HzRmpJ",Twitter Web App,0,Sihanoukville ,,
1352280679074181122,21-01-2021,BILDDuesseldorf,Als Schutz vor Corona - Luftfilter für NRW-Landtag https://t.co/QquHKgzY6t #Duesseldorf #Nachrichten,Zapier.com,0,Düsseldorf,,
1352280647801442306,21-01-2021,BILD_News,CORONA-SCHULJAHR - NRW hält an Abschlussprüfungen fest https://t.co/txBU0xb2NC,Zapier.com,0,Berlin,,
1352280642038472705,21-01-2021,LichtMinna,Sehr überraschend?https://t.co/hNskzLAHPt#SichereBildung #BildungSicher#NoFidK #merkelschuetztkinder #LasstDieSchulenUndKitasZu,Twitter for Android,1,,,
1352280638037094403,21-01-2021,MaiksF1Channel,"Lando Norris sollte diese Woche nach Hause zurückkehren, nachdem er seine Quarantäne in Dubai beendet hat, nachdem er positiv auf Covid-19 getestet wurde. #F1 #COVID19",Twitter Web App,1,,,
1352280636111925249,21-01-2021,EURepubli,"Gut dass Merkel vor der Corona Mutation warnt. Ich war vorher kurz davor, mich damit anzustecken. Hab es aber nachdem ich gewarnt wurde sein lassen.",Twitter for Android,0,"Bochum, Deutschland",,
1352280623176626182,21-01-2021,Echo_Online,Das Gesundheitsamt meldet erneut viele Verstorbene aus dem Dezember. Erklärung: Standesämter senden Sterbezahl nur einmal im Monat. Der Landrat spricht mit Bürgermeistern. #corona #darmstadtdieburg #pandemie #tote https://t.co/r2gbzt3Q5n,CleverPush,0,Darmstadt,,
1352280613047443456,21-01-2021,BILD_Ruhrgebiet,CORONA-SCHULJAHR - NRW hält an Abschlussprüfungen fest https://t.co/C9fjeyVxdX #BILD_Ruhrgebiet #Nachrichten,Zapier.com,0,Essen,,
1352280594571538439,21-01-2021,AndreaSchlegel3,https://t.co/mjgqxbPQJuAuch in Frankreich sind wenige Tage nach der Impfung 5 Menschen gestorben. Die Behörden haben Untersuchungen eingeleitet.,Twitter for Android,21,"München, Bayern",,
1352280564116676608,21-01-2021,rosi_lux,"„Hubert Kleinert, Mitglied der ersten grünen BTFraktion resümiert , «gesinnungsethischer Überschwang u komödiantische Formate d Politikdarstellung» hätten sich ggü einem «nüchternen, verantwortungsethischen Blick auf d Wirklichkeit» weithin durchgesetzt.  https://t.co/89ZI4t3i5K",Twitter for iPad,1,Deutschland,,
1352280560262139904,21-01-2021,WM_BW,"#Homeoffice-Gipfel mit Wirtschaft, Gewerkschaften und Verwaltungen: Arbeitgeber und Arbeitnehmer müssen Homeoffice-Pflicht gemeinsam, pragmatisch und mit Augenmaß umsetzen. Wir alle können uns so schützen und mithelfen, einen noch weitergehenden Lockdown zu vermeiden. https://t.co/pxTAdL3Bx8",Twitter Web App,0,"Stuttgart, Deutschland",,
1352280529299759104,21-01-2021,BlackCatLeipzig,Bin grade wieder in der Bahn unterwegs und total viele tragen hier keine Maske oder die Maske unter der Nase.Ich will die umboxen🤬🤬🤬#Leipzig #Corona #CoronaVirusDE #Maskenpflicht #Maskenverweigerer #oepnv,Twitter for Android,0,,,
1352280513885728769,21-01-2021,Bertmwalther,Niedersachsen: Corona und weniger Abiturienten zeigen Wirkung...https://t.co/xjMMX9axzc,Twitter Web App,1,"Vogtlandkreis, Sachsen",,
1352280493774016513,21-01-2021,Tanja80204061,#SamuelEckert hat bisher #Schweden mit einer Bevölkerungsdichte von 23 Einwohnern pro Quadrat km (bekomme auf dem Handy die 2 nicht hin 🙈) als parade beispielsweise gegen #Corona genommen. Das ist out. Nun ist es #Finnland mit 16 Einwohnern pro quadrat km 😂😂.Es ist lächerlich,Twitter for Android,1,"Schwalmtal, Deutschland",,
1352280482440998916,21-01-2021,Report_Antisem,Lt. @mzwebde Ratschef legt Ex-#AfD-Mitglied den Rücktritt nahe - Dieser hatte auf #Facebook direkte Parallelen zwischen den #Corona|maßnahmen und der Schoa gezogen.#Antisemitismus #Braunsbedra #SachsenAnhalt https://t.co/9C9GkDssSH,Twitter Web App,6,"Berlin, Deutschland",,
1352280476598349825,21-01-2021,FPOE_Steiermark,"ÖVP-Egoisten: Die berühmt gewordene ""Warnung"" von Sebastian Kurz wurde tatsächlich wahr, allerdings auf eine etwas andere Art und Weise...@krone_at @kleinezeitung @Oe24at @Heute_at @wochenblickat @unzensuriert #corona #österreich #impfungℹ https://t.co/558G5QweYa https://t.co/9TARG98JRU",Twitter Web App,0,"Graz, Österreich",,
1352280448790114304,21-01-2021,online_MM,Die Corona-Krise trifft auf etliche Drittliga-Clubs mit zu hohen Personalkosten. Das ist eine gefährliche Konstellation. #3Liga #Fussball #Coronakrise #DFB https://t.co/T5jq63tKeT,Twitter Web App,0,Mannheim,,
1352280387532238849,21-01-2021,RestoRhine,"Daten, die die Welt noch brauchte. Wirtschaftswunder und Nachkriegsgeneration? Alles verarmte Dummbacken! Studie finanziert von FidK? https://t.co/LAOBKBzpUo",Twitter for iPad,0,"Düsseldorf, Deutschland",,
1352280373330386945,21-01-2021,Klarname1900,"Wenn nun Zitat: die ""Kategorie „Migrationshintergrund“ abgeschafft werden soll, weil ""viele sich dadurch herabgesetzt fühlen"" - bitte auch Schubladen wie Nazi, Hetzer, Corona-Leugner abschaffen. Dadurch fühlen sich nämlich Menschen aus der Mitte der Gesellschaft herabgesetzt.",Twitter Web App,8,,,
1352280370780270597,21-01-2021,dorn_v,"#Niedersachsen: Sorge um schwere #Corona-Verläufe bei Kindern""Was sich unschön entwickelt, muss man wirklich sagen, ist die Situation bei den #Kinder|n. So viele beatmete Kinder hatten wir, glaube ich, noch nie..."" Hauptsache #Schulen offen.https://t.co/uMYcLl0xUc@GTonne",Twitter Web App,2,"Hannover, Germany",,
1352280369308049408,21-01-2021,MattinBerlin,Deutschland 2021 - eine Corona-konforme Demo für wichtige Dinge. #Corona https://t.co/EUa0zbGrwL,Twitter for Android,0,Berlin,,
1352280351188652038,21-01-2021,DerUnglaeubige,"RTL schneidet Interview-Sätze, wo Bestatter der Corona-Propaganda widerspricht.https://t.co/qzjH2yGhum",Twitter for Android,0,"Berlin, Deutschland",,
1352280338509295617,21-01-2021,SickParvisMagna,"7 Tage Sperre vorbei, gehe davon aus dass der Account bald gelöscht wird. Darum: Am 31.01. findet auch gegen den Widerstand vom ""StasiKoarl"" ,Zitat Gesundheitsmechaniker, die nächste Großdemo in Wien statt #protest #KurzMussWeg #Corona #Wien #Oesterreichhttps://t.co/HX9x6RwZAA",Twitter Web App,2,Austria,,
