tweet_id,date,username,tweet,source,retweet_count,user_location,user_place,coordinates
1352272087247958016,21-01-2021,c_lindner,"Gute Initiative von @JoachimStamp NRW schließt Lücke für freiberuflich oder selbstständig arbeitende Eltern bei den Kinderkrankentagen, die Union und SPD offen gelassen haben. Zu oft fallen in der Corona-Pandemie die Selbständigen durchs Raster. Auch dort sind die Nöte groß. CL",Twitter for iPhone,7,"Berlin, Deutschland",,
1352272042113069057,21-01-2021,RWTH,"#Corona-Blog: Die #Bundesregierung hat den #Lockdown bis Mitte Februar verlängert. Noch ist unklar, ob und wie bis Mitte Februar #Klausuren stattfinden können. Mehr dazu im Blog:https://t.co/LfsUfKTIXj#RWTH #Studium https://t.co/b64Nw7Juqm",TweetDeck,2,"Aachen, Germany",,
1352272041119002627,21-01-2021,sephamita,Abi- und Abschlussprüfungen finden trotz Corona statt. Eine Sache die uns die Pandemie nicht nimmt! Das zelebriere ich mit einem schlechten Abschluss 2021.,Twitter for iPad,0,,,
1352272029186220034,21-01-2021,BILD_News,Neue Hotspots - So verändert Corona die dunkle Seite Berlins https://t.co/S4BWKXZ47b,Zapier.com,0,Berlin,,
1352272008025956357,21-01-2021,ZambiPetra,Ja Herr Kurzwir dürfen nun wirklich fragenwarum  h a r t e r  Lockdown bis irgendwann ?was wird der VfGH dazu sagen ❓ https://t.co/0Li5uRwTY4,Twitter Web App,0,,,
1352271964057071621,21-01-2021,128_0_0_1,Quarkdenker Kommentar das in Sachsen die Afrikamutation B.1.351 des Corona Virus nachgewiesen wurde... 🤦 https://t.co/KKTLdF0b5q,Twitter for Android,0,"Berlin, Germany",,
1352271948806459393,21-01-2021,Anette20668523,"Eine Frage beschäftigt mich seit Anbeginn der PandemieWarum erkrankt kein einziger unserer Politiker ernsthaft an Corona, oder ist mir da was entgangen?Viele dieser Herrschaften befinden sich doch auch längst im RisikoalterIrgendwie seltsam🤨🧐",Twitter for Android,0,Erde,,
1352271946399023104,21-01-2021,NPG_GmbH,Immer noch im Lockdown? Wir nutzen die Gelegenheit und bringen unsere Ziele für 2021 auf Trapp. So formulierst du deine Ziele klug &gt;&gt; https://t.co/O399XCr4ON https://t.co/XiNNYfLWLP,Buffer,0,"Salzburg, Österreich",,
1352271926396411907,21-01-2021,DERKREUZKNAPPE,"#Corona Nicht leicht zu verstehen,dass man z.B.  keine Blumen oder Schulhefteim Laden kaufen kann (nur nach tel. Vorbestellungabholbar), aber man kann #Lotto spielen undsogar #Wetten abgeben.Eben bei Abholung mit einem Einzelhändler gesprochen; fürchtet um Existenz... https://t.co/d7yjuEEovw",Twitter Web App,0,,,
1352271910793588737,21-01-2021,jnbhlr,"Hat #Merkel humor oder nur beim @Der_Postillon gespickelt? https://t.co/JYQRkhdoee „Eine Priorität für mich ist ganz klar, dass zuerst Kitas und Schulen wieder geöffnet werden müssen.“Merkel sagte weiter: „Aber danach wird es natürlich nicht ganz einfach. Ich würde mal sagen..",Twitter Web App,0,,,
1352271908461547522,21-01-2021,RobertB_Fishman,#Corona Irrsinn in #Schule und #Kitas https://t.co/AZ5qLLu1FO,Twitter Web App,0,in dieser Welt und Bielefeld,,
1352271907824009218,21-01-2021,wznachrichten,"Der Spielbetrieb in den rheinland-pfälzischen Handball-Oberligen wird wegen Corona gecancelt. Der Verband teilt mit, dass der seit November ruhende Spielbetrieb eingestellt wird.https://t.co/fbVwdurQUx",TweetDeck,0,"Germany, Worms",,
1352271891155857408,21-01-2021,BAG_OFSP_UFSP,#CoronaInfoCHSituationsbericht Woche 02 epidemiologische Lage CH und FL (11. - 17.01.2021)In W 02 verzeichneten die CH und das FL insgesamt 15’178 neue laborbestätigte Fälle gegenüber 22’093 in W 01. 1/5https://t.co/XBJhhYcVDJ https://t.co/DuJsadnbQ9,Twitter Web App,4,Bern,,
1352271874345074693,21-01-2021,tom200prozent,"Der #Schlagzeilengourmet fragt sich, über wen wir hier sprechen? Geimpfte 90jährige, die mit ihren geimpften Pflegekräften gemeinsam in Urlaub fahren?#CoronaVirusDE #Corona #Pandemie #Impfstoff #Impfung #Urlaub #lockdown #Lockdown2 #Lockdown3 #Lockdown2021 @BILD #BILD https://t.co/JhBdPqmMs8",Twitter Web App,0,www.buschardt.de,,
1352271867416096768,21-01-2021,aznachrichten,"Der Spielbetrieb in den rheinland-pfälzischen Handball-Oberligen wird wegen Corona gecancelt. Der Verband teilt mit, dass der seit November ruhende Spielbetrieb eingestellt wird.https://t.co/BKA037LgMg",TweetDeck,0,"Germany, Mainz",,
1352271835849764877,21-01-2021,TheApexArchive,"#Schweden setzt seinen  bedenklich halbherzigen Kurs in der Corona-Eindämmung unbeirrt fort.Nach hoher Durchseuchung schon 2020, scheint man nicht gewillt, ""die Zügel anziehen zu wollen"".#Österreich scheint sich am ""Schwedischen Modell"" d.Ignoranz,durchaus anlehnen zu wollen.",TweetDeck,0,"Vienna,Austria",,
1352271769059680260,21-01-2021,zeitonline_pol,Im Frühjahr bat das Gesundheitsministerium Händler für Schutzausrüstung um Hilfe. Nun will es viele von ihnen nicht bezahlen. #Corona #Masken #Spahn #Abo https://t.co/med3axvnlE,ZEITonline,1,"Berlin, Deutschland",,
1352271745516974083,21-01-2021,Iptoux,"Das ist doch schon die ganze #Zeit klar, wenn man aufmerksam die #Bundestagsdebatten verfolgt. Bereits im #Dezember hat Frau #Merkel Gegenüber einer Anfrage der #AFD bestätigt dass die ""#Impfung"" lediglich den schweregrad der #Erkrankung senkt! Live im TV auf Phönix. #Corona https://t.co/Lb7Xh1HcA9",Twitter for Android,0,"Leipzig, Sachsen, Deutschland",,
1352271742954332163,21-01-2021,nittom,"Erst zu wenig #Impfstoff bestellen, sber dann #Impfpflicht für Reisende ab Sommer (sic!) einfordern.Was für ein abgrundtief widerlicher EU-Sauhaufen.https://t.co/wYZbimIjR7",Twitter Web App,1,,,
1352271708481351682,21-01-2021,tommiline,Irreführende Zahlen. Warum gibt es noch so viele Corona-Tote?.  https://t.co/KRiVv1BF9P,Twitter for iPhone,0,Germany,,
1352271679859396611,21-01-2021,MarcStoneFCB,"Extrem, wie Essener Portale wie https://t.co/IJIMQpBn91 oder https://t.co/p7xGzw8poS Corona in der eigene Bürgerschaft hypen. Zum Kotzen. #COVID19 #corona #lockdown @CoronaAusschuss",Twitter Web App,0,"Essen, Deutschland",,
1352271672917839872,21-01-2021,cetacentauri,"Kantone wollen lieber einen harten Lockdown als geschlossene Primarschulen https://t.co/ADcR2dqbgs via @tagblatt_ch Sind Kinder zu Hause, können auch die Eltern nicht ins Büro oder auf die Baustelle... alles hat System",Twitter Web App,0,,,
1352271650671177731,21-01-2021,GSchnubbel,"Hab grad ein positives Erlebnis gehabt. Der Mann auf dem Platz vor mir hustet recht häufig und dann habe ich ihn freundlich gefragt ob das sicher kein Corona sei und er meinte, nein er rauche viel. Und ich fand es so nett, dass er so reagiert hat!",Twitter for iPhone,0,St. Pauli,,
1352271635479490562,21-01-2021,KlausKluger,Richter am Amtsgericht ohrfeigt Merkel-Corona-Politik - https://t.co/4IyGOey3OY,Twitter Web App,0,"Region Hannover, Niedersachsen",,
1352271634565115911,21-01-2021,pnp,Gesundheitsminister Spahn fordert Corona-Tests für Grenzpendler https://t.co/caDQfKYBsz,CleverPush,0,Passau,,
1352271624704294912,21-01-2021,CGC_PR,Welcher Zustand (Neuinfektionen/100k) ist mit den geringsten Einschränkungen zu halten? #nocovid #Lockdown @drosten @CiesekSandra @hendrikstreeck #COVID19 #heutejournal #Tagesthemen,Twitter Web App,0,Eschborn  Impressum: ,,
1352271583616897026,21-01-2021,wuv,Die Audio-App Clubhouse ist das Thema der Stunde. Digitalstaatsministerin Dorothee Bär führt den Hype in Deutschland auch auf die Corona-Krise zurück #Clubhouse #ClubHouseApp @DoroBaer  https://t.co/NhpYuBTW8s,Twitter Web App,0,"Munich, Germany",,
1352271536812679168,21-01-2021,nasmijee,"Hat mich gerade n Chinesin am Hauptbahnhof gefragt, ob ich an ner Corona Umfrage teilnehmen kann.... BRRUUUHHH hab einfach so getan als würde ich sie nicht verstehen und meinte dann „sorry i can‘t speak german“ SHWJWHAJAHAHGAHA muss durch den ganzen hbf laut lachen",Twitter for iPhone,0,"Prishtinë,Kosovo",,
1352271506416480257,21-01-2021,RobertB_Fishman,#Weltwirtschaftsforum: Trotz #Corona ersticken die Großstädte weltweit im Dauer-#Stau. Das Auto ist kein #großstadt-taugliches #Verkehrsmittel. Ist das wirklich so schwer zu verstehen?  https://t.co/XNjyNLPyoV via @wef,Twitter Web App,0,in dieser Welt und Bielefeld,,
1352271466197372929,21-01-2021,Rene_deMonchy,"TagesAnzeiger: ""Luxus-Tycoon Johann Rubert konnte sich [...] vor dem offiziellen Start mit behördlichem Segen impfen lassen"" https://t.co/FcZQCMYZAC Vraag: Inhoeverre kan Afrikaanse miljardair zich in Nederland voorrang veroorloven voor vaccinatie? @nrc @ArneDoornebal @telegraaf",Twitter Web App,0,"Vanaf een berg, méér zien ...",,
1352271464242819074,21-01-2021,Koufogiorgos,#Grenzschließungen damals und heute#RefugeesWelcome #EUGipfel #Corona https://t.co/Dz1QDRF06Y,Twitter Web App,4,Stuttgart,,
1352271461776576523,21-01-2021,bundeswehrInfo,Seit der Ausbreitung der #Covid19-Pandemie unterstützen Angehörige des Taktischen Luftwaffengeschwaders 33 im Rahmen der #Amtshilfe an mehreren Standorten in Rheinland-Pfalz und dem Saarland. Mehr zu ihrem Einsatz ▶️https://t.co/BiraajmTqJ#Bundeswehr #FuerEuchGemeinsamStark https://t.co/0rVjZPNAMK,Twitter for Android,5,Deutschland & weltweit,,
1352271445460709378,21-01-2021,Wanderboje,Die #Wanderboje kommt trotz Lockdown nach Dresden https://t.co/pEdLGQFzpe,Twitter for iPhone,0,,,
1352271427089608704,21-01-2021,MathiasPriebe,"Sag mal @hubertus_heil, auf welchem Stern lebt ihr eigentlich? Ihr verordnet #FFP2Masken, die eh schon knapp sind und erwartet ernsthaft keine Preissteigerungen?#Corona #Wahndemie https://t.co/E68AKpAPyS",Twitter Web App,6,Lusatia/Lausitz (Germany),,
1352271406134910985,21-01-2021,PinkyQ22,"#Giffey meint die Neuregelung des #Kinderkrankengeld entlastet Erzieher*innen, weil Eltern so nicht auf Betreuung angewiesen sind.So habe ich zuletzt gelacht als.. dieses Jahr eigentlich noch gar nicht.#eltern #Corona #aha #rente",Twitter for Android,0,,,
1352271405883260930,21-01-2021,bvbsnoopy,"Bäh... Nerven, Wetter-Chaos, Corona-Dauerbeschallung auf allen Kanälen.............. Ich will endlich mal wieder einen Tag ohne Kopfschmerzen! 😕",Twitter Web App,0,,,
1352271380197249027,21-01-2021,tabernamontanu7,"Der Landkreis Berchtesgadener Land hat von allen Stadt- und Landkreisen in Oberbayern und Schwaben die höchste 7-Tages-Inzidenz •• Trotz (oder wegen?) hartem #lockdown seit 3 Monaten •• Ein Beweis, wie unsinnig und fatal der harte Lockdown ist#Soeder #Bayern #COVID19 https://t.co/0r4nx2U5JL",Twitter for iPhone,0,Rhein-Ruhr,,
1352271339797798915,21-01-2021,StephanScheuer,"#techticker: Corona-Pandemie: Hohe Margen, kaum Kontrollen: So läuft das Geschäft mit privaten Testzentren - Umgebaute Arenen, Diskotheken, Fitnessstudios: Unternehmer können mit privaten Corona-Testzentren einfach Geld verdienen. Von Laborärzten kommt K… https://t.co/PHwTByAwSh",IFTTT,2,"Düsseldorf, Deutschland",,
1352271315403763717,21-01-2021,handelsblatt,In den USA gehen die Corona-Impfungen deutlich schneller voran als in Deutschland. Discounter versprechen geimpften Mitarbeitern sogar mehr Geld. https://t.co/v1sgiTX2lY,Echobox,4,Düsseldorf,,
1352271310488031235,21-01-2021,kaffeebeimir,"Man kann noch so sagen, ich will jetzt kein Corona mehr: Das hilft nicht. Auch nicht, wenn man die Luft anhält, bis man blau wird.",Twitter Web App,1,"hannover, germany",,
1352271297221423105,21-01-2021,el_schneider,Deutsche Museumsdirektoren fordern Öffnung der Museenvia @sz https://t.co/XLcCVqhShe,Twitter for Android,0,"Nürnberg, Bayern",,
1352271296600662025,21-01-2021,FrauSeegurke,"Hab heute Nachmittag einen Termin beim Augenarzt. Bin ganz aufgeregt. So wie früher, wenn ich am Wochenende ausgegangen bin. #Corona",Twitter for Android,0,,,
1352271259229425669,21-01-2021,10000Flies,Die meisten Flies erhielt heute eine Meldung von @Blickch  aus dem Ressort Regionales.Die gestrigen News-Charts findest du hier: https://t.co/sJFrAUO5r9#10000flies #flies #news #nachrichten #Mutation #Corona https://t.co/GRYZUlJMIC,Twitter Web App,0,Düsseldorf,,
1352271258638020613,21-01-2021,gurbetcikiiz,Bin so froh das Lockdown bis 14.2 geht jz sehen wir nicht diese „romantischen Bilder“ im Restaurant oder Kino,Twitter for iPhone,0,NRW,,
1352271258365403137,21-01-2021,wznachrichten,"Sollen Eltern keinen Beitrag für Hort oder Krippe zahlen, wenn das Kind während des Corona-Lockdowns zuhause bleibt? Der Kreisausschuss Alzey-Worms hat darüber nun entschieden. https://t.co/XDsp3jhymx",CleverPush,0,"Germany, Worms",,
1352271254439546886,21-01-2021,bumbsebiene,"Okay 90% sicher dass ich Covid-19 hatte, meine Zunge sah letztes Jahr genau so aus https://t.co/DPX10Ft1Z3",Twitter for iPhone,0,"Frankfurt am Moin, Germany",,
1352271248487821316,21-01-2021,aznachrichten,"Sollen Eltern keinen Beitrag für Hort oder Krippe zahlen, wenn das Kind während des Corona-Lockdowns zuhause bleibt? Der Kreisausschuss Alzey-Worms hat darüber nun entschieden. https://t.co/ikgROV7jyq",CleverPush,0,"Germany, Mainz",,
1352271231597244417,21-01-2021,tzmuenchen,"Lebensbedrohlich ist #SARSCoV2 besonders in Alten- und Pflegeheimen. Es gibt immer wieder Fälle, wo eine #Impfung von #Risikopatienten zu spät durchgeführt wurde.#Pflege #CoronaVirusDE #Impfungenhttps://t.co/d7ZG4TO3Jr",TweetDeck,0,München,,
1352271227239473153,21-01-2021,StefanMalter,Ich habe mir für den #Lockdown einen großen Vorrat #Schokolade 🍫 besorgt - und jetzt hab ich Lust auf Weingummi! 🙄,Twitter for Android,0,"Dortmund, Germany",,
1352271203281592320,21-01-2021,SVSachsen,"Seit dem #Corona-Virus sind wir mit Vokabeln und Sachverhalten konfrontiert, die vorher bei den meisten von uns weder zum alltäglichen Sprachgebrauch noch zum Allgemeinwissen gehörten. Wir bringen Licht ins Dunkel und geben einen #Überblick: https://t.co/fIAz31oAHG (ls) https://t.co/DVdOiiLcZV",Twitter Web App,0,Dresden,,
1352271194133831681,21-01-2021,Bertmwalther,Warnung vor möglichen Engpässen im Gesundheitssystem...https://t.co/lMnKBC0FVo,Twitter Web App,0,"Vogtlandkreis, Sachsen",,
1352271190652497922,21-01-2021,dpaAFX,ROUNDUP: Positiver Corona-Trend - mit vielen Unbekannten https://t.co/s0IOWRVE0X #Wirtschaft #Finanzen,dpaAFXTweetConnect,0,Frankfurt am Main,,
1352271140052488193,21-01-2021,tarifrechner,"Corona Warn App: Kanzlerin Merkel verteidigt hohes Datenschutzniveau--Die Corona Warn App gibt es nun gute 7 Monate. In dieser Zeit, soll es laut dem Kanzleramtschef Helge Braun, trotz erheblicher Probleme ...mehr https://t.co/PAYtRZmyn7 #CoronaWarnApp #Merkel #Bundeskanzlerin https://t.co/mvytbWkxHa",Twitter Web App,1,"Germany, Schleswig Holstein ",,
1352271122067296258,21-01-2021,WDRaktuell,"Trotz #Corona-Pandemie wird es Prüfungen für das Abitur und die mittleren Schulabschlüsse geben - teils aber neun Tage später. Daran halte man fest, sagte Schulministerin Yvonne Gebauer nach einem Treffen mit den anderen Kultusministerinnen und Minister. https://t.co/laf3AkJF3X",TweetDeck,5,NRW,,
1352271114588872705,21-01-2021,Epiculis1,"klar schweden macht kein lockdown sagen sich ""ja unsere altersheim sind scheiße ausgestattet lass riskieren""",Twitter Web App,0,,,
1352271107894685701,21-01-2021,PJUllrich,So! Das örtliche Altersheim hat heute die zweite #COVID19 Impfung erhalten! Damit sind jetzt alle Anwohner*innen geschützt. Was eine Erleichterung! Für alle Mithelfenden gab’s die süßesten Namensschilder überhaupt 🥰 https://t.co/SacjenE0F0,Twitter for iPhone,0,"Cologne, Germany","Place(_api=<tweepy.api.API object at 0x000002ADEFC90040>, id='08f94128283f7bc6', url='https://api.twitter.com/1.1/geo/id/08f94128283f7bc6.json', place_type='city', name='Essen', full_name='Essen, Germany', country_code='DE', country='Germany', contained_within=[], bounding_box=BoundingBox(_api=<tweepy.api.API object at 0x000002ADEFC90040>, type='Polygon', coordinates=[[[6.894347, 51.347573], [7.137653, 51.347573], [7.137653, 51.534207], [6.894347, 51.534207]]]), attributes={})",
1352271094619791366,21-01-2021,DiverseAlarme,Nach Corona wär mal wieder n Tote Hosen Konzert angesagt,Twitter for Android,0,Hamburg/ Holstein ,,
1352271047236739073,21-01-2021,Sabrina_1988,so wie es aussieht jetzt 3x die Woche einen Corona Test machen. Langsam geht meine Nase davon kaputt 😞,Twitter for iPhone,0,cologne ,,
1352271043835133956,21-01-2021,birgitlissowsky,Studie zur Immunität nach #Corona-Infektion überrascht: Forscher mit Appell an die Bevölkerung: https://t.co/hfw0aCrCQV,Twitter for Android,1,Deutschland,,
1352271042128052224,21-01-2021,UebingC,Wie geht es #Kindern in der #Corona-Pandemie? Meine Kollegin @sveckert war für @NDRinfo in der #Arche in Hamburg. Ihre bewegende Geschichte gibt’s nebenan 👉 https://t.co/xXdTLnAluz,Twitter for iPhone,0,"Hamburg, Germany",,
1352271038873268226,21-01-2021,fr,"Bei den #Corona-Regeln zieht #Hessen Konsequenzen aus der Rechtsprechung. Altenheimbesuche sind nur noch mit negativem Corona-Test erlaubt, und für den Gottesdienst braucht es eine medizinische Maske. https://t.co/oLfW5onYyH",TweetDeck,3,"Frankfurt, Hessen",,
1352271021336887304,21-01-2021,akadsoz,Vortragsreihe soziale Ungleichheit:Am Montag sprach Prof. Susanne Strauß @unikonstanz über Auswirkungen der Corona-Krise auf geschlechtsspezifische Arbeitsteilung. Am 25.1.21: Jörg Rössel @UZH_ch über Ungleichheit kultureller Teilhabe.Anmeldung: https://t.co/kNUfoJJKWG,Twitter for Android,4,Mannheim - Germany,,
1352271020779073541,21-01-2021,betonblog,"Wenn wir mal ganz ehrlich sind, müssen wir erkennen, dass die allgemeine Strategie in Sachen #Corona die des 'langsamen Ausläpperns' ist.Man will, dass die #Wirtschaft weiterläuft, auf Kosten von vielen zusätzlichen Toten, denn 1 echter #Lockdown würde  die Wirtschaft lahmlegen.",Twitter Web App,0,Frankfurt am Meer | Los Santos,,
1352271014856687619,21-01-2021,Bertmwalther,Fest steht: Es soll ohne russisches Serum funktionieren...https://t.co/kTWBuHOUwA,Twitter Web App,0,"Vogtlandkreis, Sachsen",,
1352271005977370624,21-01-2021,aufstiegsstip,"„Meine #Corona-Infektion hat mich zutiefst verstört“ – @Daimler-Managerin @franzikempis nutzt ihr #Sabbatical, um ein #Impfzentrum der @malteserberlin mit aufzubauen.https://t.co/8hr3DdmJi7 via @KarriereSPIEGEL",Hootsuite Inc.,0,Bonn,,
1352271000684154880,21-01-2021,rosi_lux,"„Impfungen sind die große Hoffnung im Kampf gegen das Corona-Virus. Aber wer einen Termin haben will, sollte sich auf eine wahre Odyssee einstellen. Wir dokumentieren den Erfahrungsbericht eines Betroffenen. https://t.co/TwJ6nCOFxE",Twitter for iPad,1,Deutschland,,
1352270991553138693,21-01-2021,tablettenpoesie,Einma’ richtig statt Lockdown-Light. Waslos? Neuseeland hat’s vorgemacht.,Twitter for iPhone,0,Diaspora,,
1352270988344438794,21-01-2021,Sonntag1410,"Dramatische Lage in PT 🇵🇹: kein Lockdown, Schulen offen, explodierende Neuinfektionen und starke Verbreitung der Mutante #B117. Katastrophal.Kliniken in Portugal droht wegen Corona-Mutation der Kollaps https://t.co/YTncmyTjrV",Twitter Web App,2,"Berlin, Germany",,
1352270981402910720,21-01-2021,Eddie_1412,Corona-Insolvenzwelle? IHK in NRW warnt vor Aus für zehntausende Kleinbetriebe https://t.co/4JGRhQGXAM,Twitter Web App,6,,,
1352270980828131329,21-01-2021,merkur_de,"Lebensbedrohlich ist #SARSCoV2 besonders in Alten- und Pflegeheimen. Es gibt immer wieder Fälle, wo eine #Impfung von #Risikopatienten zu spät durchgeführt wurde.#Pflege #CoronaVirusDE #COVID19https://t.co/ds6AvjJev9",TweetDeck,0,"München, Oberbayern",,
1352270980043972613,21-01-2021,Lahusen,Was in der ganzen Covid 19 Diskussion viel zu kurz kommt und mehr Beachtung verdient:YOLO,Twitter for iPhone,0,Bremen / Göttingen / New York,,
1352270976663363586,21-01-2021,tommiline,Corona-Vakzin wohl nicht bedroht. Brand bei weltgrößter Impfstoff-Firma.  https://t.co/P4HPQG8VW4,Twitter for iPhone,0,Germany,,
1352270972854947844,21-01-2021,starmedia777777,"wie bitte ist es möglich, dass die Corona Ausgaben nicht kontrolliert werden dürfen????Das ist jetzt aber ernsthaft nur ein schlechter Scherz???? https://t.co/qFO0vFbk1C",Twitter for Android,0,,,
1352270961165414403,21-01-2021,SWPde_bot,"#SWPPlus Corona Schule Ulm: „Die Schulen öffnen, sobald es geht“ https://t.co/Aocp9YI9qX",SWPde_bot,0,"Ulm, Deutschland",,
1352270928865013762,21-01-2021,Netzdenunziant,Was für ein Irrsinn.https://t.co/nflfnNvTbs,Twitter Web App,1,denunziantenstadl@protonmail.com,,
1352270908195545091,21-01-2021,dark_beelzebub,Meine Oma ist eben an Corona gestorben.,Twitter for Android,1,,,
1352270881406525448,21-01-2021,mgl1860,"Uerdingen werden aufgrund der Eröffnung des Insolvenzverfahrens 3 Punkte abgezogen. Normalerweise wären es 9 Punkte, jeodch wurde aufgrund der Corona-Lage das Strafmaß für die Saison 2020/21 gesenkt. #tsv1860",Twitter Web App,1,,,
1352270872011300864,21-01-2021,wimipolis,"Gerade eben mit einer Kollegin gesprochen, die ich seit einem Jahr nicht gesehen habe. Was mir erst aufgefallen ist, als sie vor meinem Büro stand. Es ist die Kollegin aus dem Büro nebenan. Dieser Corona-Quatsch macht wirklich weich in der Birne, Leudde...",Twitter Web App,0,Überall und nirgendwo.,,
1352270863761092610,21-01-2021,vzhessen,"Ab Samstag auch in #Hessen verpflichtend im #ÖPNV und beim Einkaufen: Medizinische OP-Maske oder #FFP2Maske. Hier im Überblick , worauf Sie bei Kauf und Nutzung achten sollten. Mehr Infos zum Schutz durch die #Maske: https://t.co/8SSYEF7OKu #wirsindda #COVID19 https://t.co/xEAibkfEnZ",Twitter Web App,3,"Hessen, Deutschland",,
1352270860795559936,21-01-2021,tonline_news,Corona-Maßnahmen übertrieben? Das denken die Deutschen https://t.co/nPHO3UIOev,dlvr.it,1,Berlin,,
1352270820714950656,21-01-2021,tubakrise,"""Merkel äußert Verständnis für Corona-Frust, warnt aber vor Mutationen."" wäre vor zwei Jahren eine richtig merkwürdige Schlagzeile gewesen.#CoronaVirusDE #Bundesregierung",Twitter for Android,0,,,
1352270811072258048,21-01-2021,pirat_stade,Coronakrisenmanagement in Deutschland. Symbolbild:#COVID19 https://t.co/uVEnRBUEtT,Twitter Web App,0,Stade,,
1352270775831703554,21-01-2021,JoachimJahn,Eine ganz ausgezeichnete Handreichung für den Alltag zum Umgang mit #Corona!https://t.co/IJEes6xIvh,Twitter Web App,1,,,
1352270774040719366,21-01-2021,tonline,Kolumne zum Kampf gegen Corona: Merkel wird Teil des Problems https://t.co/8AjqpaRQw3 https://t.co/nFHhmfUYJC,Buffer,2,"Berlin, Deutschland",,
1352270759159328769,21-01-2021,morgenpost,Weitere Nachweise von Corona-Variante auf Krankenhausstation https://t.co/yWHvhSzWCi https://t.co/hhm2GN2SOf,Echobox,2,Berlin,,
1352270747444641792,21-01-2021,RathausSPD,"Auch während #Corona bleibt der #ÖPNV das wichtigste Verkehrsmittel. Daher fordern wir, das bestehende Sicherheitskonzept weiter zu verbessern und die Zukunft der MVG zu sichern. „Die Fahrgäste sollen sich noch sicherer fühlen"", so @stadtrat_gradl.   https://t.co/j4XliCTVKM #spd",Twitter Web App,1,München,,
1352270744139542528,21-01-2021,MDRAktuell,Weniger Neuinfektionen und die Lage auf den Intensivstationen entspannt sich – sind wir über den Berg? Macht die Virusvariante aus Südafrika Impfungen weniger wirksam? Und: Aktuelle Erkenntnisse zu LongCovid. Der Corona-Kompass mit @AlexanderKekule 🎧 https://t.co/OdtTI5Kpa1,TweetDeck,0,"Halle (Saale), Deutschland",,
1352270739504820231,21-01-2021,ArgYouCOM,Mit #COVID19 wird Digital immer wichtiger: Marktforschung funktioniert heute ohne Ansteckungsgefahr mit der Find-Maschine von ArgYou: https://t.co/LehNWCLgfXHeute aktuell auf LinkedIn: https://t.co/MX9qrE3XBg#Marktforschung #Digital #Online #messenstattraten https://t.co/x5P22FBbui,Twitter Web App,0,"Zug, Schweiz",,
1352270730466045953,21-01-2021,FrankNiessen1,"Wissenschaftler Merkel: Ganz Europa braucht  Lockdown Schon „Hunderte Wissenschaftler“ ist sowas von hirnrissig, weil nicht wahr. Wir haben auch nicht einmal die erste Welle überstanden, denn Wegsperren ist nicht die Lösung, der Virus ist da, wenn wir wieder raus dürfen.",Twitter Web App,0,,,
1352270730050854916,21-01-2021,mircoholz,Wir haben Corona und heute ist #Weltknuddeltag ... https://t.co/ofcv0AlXRS,Twitter for Android,0,"Leer, Niedersachsen",,
1352270728985419782,21-01-2021,RD_RPS,Die Entwicklung der Kurzarbeit in #RLP zusammengefasst.  #WirinRPS #Corona #Kurzarbeit Mehr Infos zum Thema Kurzarbeitergeld ➡️https://t.co/kUNT3wMN7O https://t.co/okoOTLu0iL,TweetDeck,0,Saarbrücken,,
1352270722840854529,21-01-2021,tearDistants,"Nervenzusammenbruch, ich hasse Schule und corona, mein schulblock wurde auf mein op Termin verschoben.I want to die",Twitter for iPhone,0,,,
1352270719586078720,21-01-2021,3mausimhaus,Erbauliches im #Corona - #Homeoffice https://t.co/oXYa9dFRVD,Twitter for Android,2,Germany- Frankfurt/ Bergstraße,,
1352270711298076675,21-01-2021,fototavi,"""...es sind ja nur 2-3% richtige #impfgegner ..."" Ist das wirklich so, Herr Prof. Wieler?Laut meiner Studie sind 90% gegen eine #Impfung und der Rest will erstmal abwarten. #COVID19 #Impfstopp #impfpflicht #Impfstrategie https://t.co/P90yDpQvhr",Twitter Web App,0,"Madrid, Spanien",,
1352270706961244163,21-01-2021,johannLpunkt,Vorbildlicher Akt richterlicher Souveränität: Lockdown gecrashed  https://t.co/HWTQeJCJPv,Twitter for iPad,0,,,
1352270700170633222,21-01-2021,WTrier,Corona-Übertragung: Neue Studie schockt Experten https://t.co/UilCyDyesI,Twitter Web App,1,"Trier,",,
1352270677760503808,21-01-2021,EggmanOrWalrus,Lockdown bedroht Existenz: Modehändler sitzt auf 5000 Winter-Klamotten | Regional #tech https://t.co/DvPPvWVaq7,ElectronicSheepForInsomniacs,0,"San Francisco, CA",,
1352270645019734018,21-01-2021,Cash_Back_Team,"Bidens erster Tag im Amt, 8000 Corona Tote! Ist das OK CNN?",Twitter for iPhone,0,worldwide,,
1352270628011782145,21-01-2021,rponline,"Das #Schulministerium in #NRW hält trotz der #Corona-Krise auch in diesem Schuljahr an Abschlussprüfungen fest. Ziel seien „vollwertige Abschlüsse, die ohne Abstriche in ganz Deutschland anerkannt werden“. https://t.co/qVVdwjIhkc",Twitter Web App,0,Düsseldorf,,
