tweet_id,date,username,tweet,source,retweet_count,user_location,user_place,coordinates
1348671135341305859,11-01-2021,donmartin62,"Verschärfte C Regeln? 😂😂🤣🤣😂😳 Was war heute los? Auf den Straßen, der Verkehr, so viele Menschen unterwegs, zu Fuß und mit Auto......Manmanmanmanamna...man merkt hier überhaupt nix con Corona.",Twitter Web App,0,"Moers, Deutschland",,
1348671105117126659,11-01-2021,TRDSRLZ,"Für die #fdp sind die wahren Opfer von #corona nicht die Toten. Und das denk ich mir nicht aus, #Lindner findet das so gut, dass er es in seine TL haut... Respekt für soviel Arroganz. Ich bin ein solcher Elternteil der angesprochen ist, ich fühle mich nicht als Opfer! https://t.co/gay4QQ2lP7",Twitter for Android,2,Blüdhaven,,
1348671086548951041,11-01-2021,DjMissError,London: Krankenwagen warten bis zu 9 Stundenhttps://t.co/hK1NINIcyKÜber @updayDE gesendet,Twitter for Android,0,,"Place(_api=<tweepy.api.API object at 0x0000027537100040>, id='fdcd221ac44fa326', url='https://api.twitter.com/1.1/geo/id/fdcd221ac44fa326.json', place_type='country', name='Germany', full_name='Germany', country_code='DE', country='Germany', contained_within=[], bounding_box=BoundingBox(_api=<tweepy.api.API object at 0x0000027537100040>, type='Polygon', coordinates=[[[5.8663566, 47.270127], [15.0418536, 47.270127], [15.0418536, 55.056823], [5.8663566, 55.056823]]]), attributes={})",
1348671045012754436,11-01-2021,DieSachsen,Mehr als 500 Corona-Verstöße in Leipzig in einer Woche https://t.co/AK5u11oscY #CoronaSN #COVIDー19 #Gesundheit #Krankheiten #Polizei #Cor...,DieSachsen,0,Sachsen,,
1348671025282748416,11-01-2021,AnChVIE,nächster Lockdown nach den Semesterferien?,Twitter for Android,0,"Vienna, Austria",,
1348671023575666689,11-01-2021,EPinDeutschland,"Die EU hat Vereinbarungen mit 6 Unternehmen und bisher sind 2 #Covid19-#Impfstoffe zugelassen. Morgen diskutieren die Europaabgeordneten mit der Chefverhandlerin der Europäischen Kommission über die Entwicklungen. Die Sitzung des @EP_Environment streamen wir live, stay tuned. https://t.co/9gdmP9S4vB",Twitter Web App,0,Deutschland,,
1348670999571656704,11-01-2021,juertiss,"Bohlen, Hummels, Thomalla: Wie sich Promis aus dem Lockdown herauskaufen - FOCUS Online https://t.co/a7skffl2df",Twitter for iPhone,0,,,
1348670967405539328,11-01-2021,Michael46197333,"#Palmer Der Tübinger Oberbürgermeister Boris Palmer (Grüne) fordert ein Ende der strikten Corona-Maßnahmen. ""Es reicht jetzt"", sagte er am Sonntagabend in einer ""Bild""-Sendung. Anfang Februar müsse kontrolliert wieder geöffnet werden.Noch einer, der begriffen hat!",Twitter Web App,0,,,
1348670950963818496,11-01-2021,TKellerhoff,".@Aufstehen_de 2021: #Wagenknecht wiederholt widerlegte und nicht haltbare Argumente im Focus (https://t.co/vmf1NuFmC7) und #Streeck verrennt sich in Fehlbehauptungen und tut alles dafür, dass „die Soziologie“ auch zukünftig nicht gehört wird (https://t.co/tdoAqUD2Q2)... https://t.co/4HbURqtNMq",Twitter for iPhone,0,,,
1348670898585407492,11-01-2021,GHasselwander,Deutscher COVID-19 Ag-Schnelltest erhält Marktzulassung - https://t.co/QfdHtILhYh https://t.co/gIPDjXTkIN,News-Script,0,"Deutschland, Eifelregion",,
1348670895749939203,11-01-2021,tonlinepanorama,Corona-News – Bottrop: Virus-Variante aus Südafrika bei Mann nachgewiesen https://t.co/SI3a452kTO,dlvr.it,1,Berlin,,
1348670893493420040,11-01-2021,spektrum_de,Möglichst schnell möglichst viele Menschen impfen - oder doch lieber an die Bestimmungen der Zulassung halten? Die Debatte über die #Impfstrategie ist kompliziert. Doch vor allem Impf-Fachleute sind bei dem Vorschlag skeptisch. #covid19 #impfung https://t.co/2KcLwcvYLP,dlvr.it,4,Heidelberg,,
1348670893363441665,11-01-2021,Korqay1,pass auf dich coronaich heiß jetzt corona https://t.co/mKhrNBBY69,Twitter for iPhone,0,"Weed, CA",,
1348670889219534852,11-01-2021,SZ_Muenchen,Das Modehaus C&amp;A will für seine Filiale in der Kaufingerstraße für den ersten Lockdown weniger Miete zahlen - der Richter lässt Skepsis durchblicken: https://t.co/znNey1ed2n,SZ.de Twitterbot - München,3,München,,
1348670884756803584,11-01-2021,boersenzeitung,"Der verschärfte Lockdown und die weiter steigenden Infektionszahlen lasten zunehmend auf dem Wachstumsausblick für 2021. Ökonomen schrauben ihre Prognosen für Deutschland sowie für den gesamten Euroraum derzeit nach unten, zeigt unser #Konjunkturtableau.https://t.co/tY7rX0ABOE https://t.co/SAxgVWVDzH",Twitter Web App,0,"Frankfurt, Germany",,
1348670869527293956,11-01-2021,IGutmensch,Im Gegensatz zu #Corona geht die #Klimakrise nicht einfach so vorbei und Impfstoff gibt's auch nicht.Blabla und #Absichtserklärungen hatten wir schon genug.#Omas4future #OnePlanetSummit #keinGradmehr #time4change NOW https://t.co/01jcNaLcli https://t.co/hZL94j3aCP,Twitter for Android,0,NRW,,
1348670856256499716,11-01-2021,HubertDeMeulder,Junger Mann stirbt nach Corona-Kontrolle durch Polizei in #Schaerbeek https://t.co/oN9ERStkht,Twitter Web App,0,Brasschaat,,
1348670850627743745,11-01-2021,OlafGersemann,😳😳😳80%?!(Screenshot aus dem neuen #Corona-Lagebericht des RKI) https://t.co/3e4b5If8hr,Twitter Web App,40,"Berlin, Deutschland",,
1348670840880181248,11-01-2021,WirSindDerGraf,"Ein Fall für Herrn #Homburg!Er muß sofort nach GB reisen, der Regierung seine finanzwirtschaftliche Expertise anbieten. Wer sonst sollte das Land noch retten können?https://t.co/iELYMVVtut",Twitter Web App,0,Erde,,
1348670795850149891,11-01-2021,w0pr001,Hab mich gerade mal für die Corona Schutzimpfung angemeldet und festgestellt dass ich mit einem BMI &gt; 30 zur Risikogruppe gehöre.Hat mich die Website gerade fett genannt? 🧐,Twitter Web App,0,Landshut/Bayern,,
1348670780914151426,11-01-2021,Hammaburg2,Wow. Bei @BLÖD @BILD gibt es jetzt pro LKW mit Impfstoff einen Artikel 😂😂😂🙈🙈🙈 https://t.co/ZBtcqJpThM,Twitter for iPad,0,Hammaburg,,
1348670778930323456,11-01-2021,SZ_Politik,"Bayerns Ministerpräsident Markus Söder fordert zusätzliche deutsche Produktionsstätten zur Herstellung von Impfstoffen gegen das Corona-Virus. Dazu solle eine ""nationale Pharma-Allianz"" gegründet werden, sagt er @RobertRossmann https://t.co/zsJQswKmrb",SZ.de Twitterbot - Politik,1,München,,
1348670753823207428,11-01-2021,MiaWok62,Corona-Ursprung: China erlaubt Einreise von Forscherteam https://t.co/2PxnPhy2AW via @tonline,Twitter Web App,0,"Stuttgart, Deutschland",,
1348670745078099972,11-01-2021,hs_humanwiss,Macht uns die #Corona-Pandemie egoistischer? Gemeinsam mit Kolleg/-innen der Universitäten @Stanford @unierfurt @UniHannover bewertet #Bevölkerungsschutz-Experte Prof. Dr. Henning Goersch @hs_humanwiss unser Verhalten in der Krise @zeitonline. Lesenswert! https://t.co/wOmLOSqah6,Twitter Web App,1,Berlin,,
1348670738975354882,11-01-2021,Delmenews,Die Zahlen der Corona-Patienten im JHD sind leicht rückläufig. Seit Samstag kann ein Teil der Belegschaft mit Impfungen versorgt werden. Rund 120 Beschäftigte ließen sich bisher impfen. Von der Maskenpflicht entbindet die Impfung allerdings nicht.  https://t.co/h4bPh70rL8,Hootsuite Inc.,0,"Delmenhorst, Deutschland",,
1348670734697115649,11-01-2021,emwiemaikel1966,"Langsam habe ich echt die Schnauze voll von diesen ewigen Programmänderungen wegen #Corona @DasErste. Es gibt auch noch Leute, die was anderes sehen wollen, als dieses dauernd gleiche Gelaber #annewill. Wo ist #RebeckaMartinsson?",Twitter for Android,0,"Bremen, Deutschland",,
1348670734168711173,11-01-2021,heissgemein,"heute ein anti-corona diktatur-pamphlet in der post gehabt, dessen co-autor wirtschaftswissenschaftler istwas soll ich dazu noch sagen",Twitter for Android,0,leipzig,,
1348670725461319680,11-01-2021,insgrins,Dauerhafter Lockdown: Corona als Generalprobe für die Klimakrise https://t.co/YIfbgRINOm via @welt,Twitter Web App,0,,,
1348670682075455488,11-01-2021,Miellettes,Übrigens - das vielgepriesene Irland (das mit den offenen Schulen) hat mittlerweile eine Inzidenz von 1291. #B117 #keinepointehttps://t.co/OGG0N1V5E9,Twitter Web App,17,Quelque part en Allemagne,,
1348670680963944451,11-01-2021,Rechtsdirektor,"Falls wir die Pandemie bis September einigermaßen imGriff und &gt;50% geimpft haben sollten, fürchte ich, dass so manche Opposition die wirtschaftlich Gebeutelten in schändlicher Weise aufstacheln will.„Wir hätten es auch ohne Lockdown geschafft“„CDU hat dich insolvent gemacht“ https://t.co/LbOfsDJMur",Twitter Web App,1,NRW,,
1348670673208700928,11-01-2021,Economicus,Was soll man dazu noch sagen 😱England dürfte bald ausgestorben sein 😂 ⁦@SHomburg⁩ ⁦@mfleischhacker1⁩ ⁦@janfleischhauer⁩ ⁦@RolandTichy⁩ ⁦@KoeppelRoger⁩ ⁦@reitschuster⁩ #COVID19 #UK #Corona  https://t.co/toSZO0g7xh,Twitter for iPhone,0,"Wien, Österreich",,
1348670655684870146,11-01-2021,Monika17M,Hoffnung auf Medikament: Tübinger Forscher entdecken Schwachstelle des Coronavirus  | Das Erste https://t.co/7XAYYzUPRI,Twitter Web App,0,,,
1348670643018072065,11-01-2021,digitvde,Heute Abend #ProSiebenSpezial mit @jensspahn. Näheres hier: https://t.co/fu473UODb2 https://t.co/IbSHo1xmdZ,Twitter Web App,1,"Leipzig, Germany",,
1348670621568421889,11-01-2021,R1chtungsweiser,"https://t.co/Em11tm1yP9Was mir am meisten auf die Nerven geht, ist diese Heuchelei in Form von, „wir müssen unsere Alten schützen“…das hat bis vor Covid keine Sau interessiert, wie es bei uns aussieht, während wir kaputtgespart wurden...",TweetDeck,0,,,
1348670588177539075,11-01-2021,theotherphilipp,"Grossartig!»Nach unbeherrschbaren Größenordnungen sieht Corona, so betrachtet, jedenfalls nicht aus.«»… wäre überhaupt die wichtigste Begründung für die mit ewiger Wiederkehr drohenden Lockdowns entfallen. Welche Begründung bliebe dann noch?«https://t.co/HYF8s1NVpG",Twitter Web App,1,,,
1348670582599069698,11-01-2021,DM_Magazin,"Die #Corona-Krise ist anders als bisherige, denn bekannte Mittel versprechen keine nachhaltige Lösung. Und sie bedeutet eine Zäsur für pro­duzierende #Unternehmen. In der Zeitrechnung „After Corona“ stellen sich wichtige #Zukunftsfragen. #smartfactoryhttps://t.co/9uwVhpvGO5 https://t.co/18tOJpuJZ9",Blog2Social APP,1,"Munich, Bavaria",,
1348670580174811136,11-01-2021,Ahnenforscher2,https://t.co/oGuSHajNSP Kinder können sich mit dem Coronavirus infizieren und es auch an die Grosseltern/Eltern/Geschwister weitergeben. Symptome zeigen Kinder meist nicht. Darum Maskenpflicht ab 4. Klasse oder Schulen schliessen! @dschweizer58 @elvira_greco @silviasteiner,Twitter Web App,0,,,
1348670579914776579,11-01-2021,georgsatzinger,Der #Lockdown setzt Schüler und Schülerinnen stark zu vor allem denen in der Oberschule. Interessant wäre es auch zu wissen wann #Studenten wieder in die #Hybridlehre oder Präsenzlehre zurückkehren können und wie der Plan fürs Sommersemester aussieht.https://t.co/Doj6hLdg25,Twitter Web App,0,,,
1348670556925800448,11-01-2021,FFMbyBicycle,"Verkehrs- und Corona-Regeln? Pah, alles nur Empfehlungen! https://t.co/L4dgBr2qKD",TweetDeck,0,"Frankfurt on the Main, Germany",,
1348670531315380226,11-01-2021,ThomasNueckel,Gute Nachrichten für Eltern mit Kindern in einer Kita: Kita-Beiträge für den Monat Januar werden erstattet. Das hat Familienminister Joachim Stamp mitgeteilt.Der verschärfte Corona-Lockdown ist eine Herausforderung für viele Familien - und vor allem für Alleinerziehende. https://t.co/WF507Lrz30,Twitter Web App,0,Herne/Düsseldorf,,
1348670524155711490,11-01-2021,BR24,Unser BR24-#Newsletter ist raus! 📯📫Die Themen heute ua:▪️  Neue #Corona-Regeln: Das müssen Sie wissen▪️ #15KilometerRegel: #Brandl will Handy-Daten auswerten▪️ So ist der Schulstart gelaufenIhr wollt ihn auch? Hier geht's zur Anmeldung: ⬇️https://t.co/uyjWMuUza0,TweetDeck,2,"München, Bayern",,
1348670515465121798,11-01-2021,NiemalsD,Hoffentlich funktioniert der virtuelle #CDUParteitag nicht wie die virtuelle Schule seit Corona. Denn sonst gibt es den neuen Vorsitzenden erst nach der Bundestagswahl #lockdown #Milchkanne #neinzuMerz #CDUVorsitz,Twitter for iPhone,6,"Mannheim, Baden-Württemberg",,
1348670509148483587,11-01-2021,AnastasiaZampo,"Ich zähle die Tage bis wieder Ordnung auf dem Kopf herrscht 🤣 und drücke die Daumen - für ganz vieles - aber auch für meine Beauty Salons, die straucheln und bangen... bis hoffentlich bald wieder #supportyourlocals #coiffeur #vogelnest #coronadiaries #lockdown #greek #autorin https://t.co/tHidyMfa0B",Twitter for iPhone,0,Berlin,,
1348670496750100482,11-01-2021,lilo524,Nicht nachvollziehbar! Wann endlich steht dasVolk auf?Wenn die ganze Wirtschaft am Boden liegt und das rein Virtuelle das Analoge ersetzt hat? Wengen BE: Wegen Corona-Virus: Kanton Bern sagt Lauberhorn-Rennen ab | https://t.co/Bl5Dfd6rzW https://t.co/kfAwvUbTjU,Twitter for iPhone,1,,,
1348670483563225088,11-01-2021,noen_online,Haager Seniorenzentrum verzeichnete insgesamt 78 Fälle https://t.co/QeHD2CJobi,Echobox,0,Niederösterreich,,
1348670482783072262,11-01-2021,bvz_online,Schulen erhalten fünf Mio. Corona-Selbsttests https://t.co/GsECeq7Rqv,Echobox,0,"Eisenstadt, Österreich",,
1348670455205523458,11-01-2021,srfluzern,Friedli Kilbi geht nicht mehr in die Beiz und auch nicht Skifahren -mit Corona hat das aber alles nichts zu tun. Die neue Apropos-Kolumne von @srfluzern zum Wochenstart: https://t.co/XTvaxo7eIl,TweetDeck,0,Luzern,,
1348670447752257539,11-01-2021,KatJend,"#homeschooling #ZeroCovidJetzt #NoFidk Heute ist eine Mutter von zwei Kindern AN Covid19 gestorben. Gibt es für ein Kind etwas Schlimmeres? Und die Kultusminister alle so: Ja, neee, Distanzunterricht ist schlimmer",Twitter for iPhone,2,,,
1348670394224566274,11-01-2021,_FritzBollmann_,Lasst KEINEN Fremden in eure Autos https://t.co/7OyM7QJUfy,Twitter Web App,0,JWD 🌲 janz weit draußen 🌲,,
1348670333411336193,11-01-2021,TenoreDiego,Durch #Corona wächst die Einsamkeit. Das merkt auch die Telefonseelsorge in #Duisburg https://t.co/9gt63riHqS,Twitter for iPhone,0,"Duisburg, Deutschland",,
1348670326750765060,11-01-2021,schmali7,Klare Regeln fürs Homeoffice. Corona lässt sich nicht per Appell bekämpfen. 🤔 Wohl eher: „Idioten lassen sich nicht von Appellen beeindrucken oder lenken und pfeifen drauf“ !!!  https://t.co/tVnXGdTsvn,Twitter for iPhone,0,,,
1348670315577155586,11-01-2021,8694sundance,Nach gut einem Jahr #COVID19 stelle ich mit bedauern fest Viren sind schlauer als Menschen. 😔Nach jedem unqualifizierten Aufschrei nach Lockerungen lacht sich das Virus ins Fäustchen. #Corona #Lockdown,Twitter for Android,5,,,
1348670296249794560,11-01-2021,akduell,Trotz #Digitalsemester müssen Studierende das #Semsterticket bezahlen. Im August äußerte sich der VRR auf Nachfrage: „In den Verträgen ist eine Erstattung für eine Nicht- oder nur teilweise Nutzung des Tickets nicht vorgesehen.“ Unser Artikel dazu:https://t.co/Lm0I3pUXwM https://t.co/glr0wvjI7x,Twitter Web App,0,Duisburg & Essen,,
1348670296073646080,11-01-2021,BoeltM,"Wieso noch, @merkur_de? München ist wieder ein verschlafenes Nest. Seit Mitte der 2000er ging es doch wieder bergab. Und das, was aus der Partystadt der 90er noch übrig bliebt, hat Corona endgültig zerstört. https://t.co/G1PtZywYZd",TweetDeck,0,"Echarding, München",,
1348670290746863634,11-01-2021,FXStreetnewsde,UK PM Johnson: Werden das Impf-Tempo gegen Covid-19 deutlich erhöhen https://t.co/gNmIMcA1Xt,FXstreet.de.com,0,Barcelona,,
1348670275446071296,11-01-2021,M_Erberich,"Großbritannien steckt im dritten nationalen #Corona-Lockdown, aber der ""Elite""-Fußball geht fast unbeirrt weiter. Diese Bevorzugung gefällt vielen nicht - auch innerhalb des Fußballgeschäfts.https://t.co/dysDMopluB",Twitter Web App,0,"Brighton, England",,
1348670274112266240,11-01-2021,keltenblick,"Der Grüne Obernazi Palmer hat doch den Schuss nicht gehört.Wie kann dieser Salongrüne behaupten, der Lockdown sei wirkungslos? https://t.co/AilzcIM58S",Twitter Web App,0,,,
1348670255552491524,11-01-2021,maracuja_m,"Ich habe meinen Vater vor fast drei Jahren eher zufällig gesehen. Gesund. Eben schickte er mir ein Foto welches er heute gemacht hat. Nach Corona, inklusive Intensivstation. Ich hab nicht viel für ihn übrig aber bitte Leute. Schützt euch.",Twitter for iPhone,1,Ruhrgebiet,,
1348670252163469312,11-01-2021,Pitsch_Peter,"Dieser absolut unverantwortliche Egoist @ob_palmer Boris Palmer zum Corona-Lockdown: ""Es reicht jetzt, wir müssen leben"" https://t.co/jh3JV6yldd",Twitter for iPhone,1,,,
1348670247977549829,11-01-2021,ChristophFreina,Anmeldung zur #Covid19-Impfung absolviert. 😊 https://t.co/omIXKnqnVc,TweetDeck,0,Freilassing/BGL/BY/DE/EU,,
1348670216738365447,11-01-2021,hessenschau,Opposition wirft Beuth Vetternwirtschaft vor | Verlängerung des #Corona-Lockdowns | AfD blitzt mit Beschwerde ab - Was heute wichtig war: Der Tag in Hessenhttps://t.co/GdivPeazi4,TweetDeck,2,"Frankfurt am Main, Germany",,
1348670214175674368,11-01-2021,EBD_EW,"Wir sind neugierig: Arbeitet ihr schon an Wettbewerbsbeiträgen? Auch im #Homeschooling &amp; #Lockdown-Unterricht? 💻🤓Malt ihr, schreibt ihr, oder habt ganz andere Ideen? 🎥🎨🎤Wir sind gespannt &amp; freuen uns riesig, falls ihr einen kleinen Einblick gebt 🤗 #europäischerwettbewerb https://t.co/M9R20exFNv",TweetDeck,0,Berlin,,
1348670209327063040,11-01-2021,salesman_ch,Die tödlichsten #Naturkatastrophen 2020 https://t.co/p08EoBS5Bi Erschreckend - an fast alle diese Ereignisse kann ich mich nicht erinnern. Wie intensiv wurde über diese in den Medien berichtet z.B. im Verhältnis zur Corona-Pandemie? Einfluss #Klimawandel auf diese Ereignisse?,Twitter Web App,0,"Aarburg, Schweiz",,
1348670193673904132,11-01-2021,mynamezbell,"Ich fänds cool, wenn die Leute, denen während Corona mal langweilig ist, 'n paar Unternehmen spamen würden bzgl Reduktion von Verpackungsmaterial. Für mich sind es 5 Minuten, die ich denen ne Mail schreibe und wenn es genug Leute machen, geht denen das ordentlich auf'n Sticker.-&gt;",Twitter for Android,0,,,
1348670178821857293,11-01-2021,Keissy__,"#HartzUndHerzlich Wüsste man nicht, dass die Folgen neu sind würde man nicht drauf kommen, dass Corona da schon existiert. Familienbesuche, keine Masken, ständiges herumlaufen bei den Nachbarn, Urlaub, Geburtstagspartys",Twitter for Android,0,,,
1348670154264219651,11-01-2021,OlafGersemann,"#Berlin: 1036 neue #Corona-Fälle, 26 Tote - und eine durchgehend rote Corona-Warmampel. https://t.co/t2cea8Pcrj",Twitter Web App,6,"Berlin, Deutschland",,
1348670154138415105,11-01-2021,PapaPicknick,"„Als Vater und Ehemann“ habe er „die menschliche Ebene verfolgt und das getan, was sich richtig angefühlt hat“. Untergetaucht seien sie in . . . . "" https://t.co/YycNRj0rFF",Twitter Web App,1,Berlin-Parks,,
1348670115999580160,11-01-2021,nilsb0,"Eine geile #tracing app haben wir. Das, was sie kann, zeichnet sie dabei nicht als besonders aus, sondern das, was sie dabei eben nicht kann. Nutzer ausspähen oder persönliche Daten weiter geben.@_FriedrichMerz wird das als Kanzler ändern. 🤦 https://t.co/LHcgpjjuU5",Twitter for Android,0,,,
1348670111301959683,11-01-2021,stefanschaetti,Es wäre schöner - wenn man auch das Wort Corona - nicht dauernd .... wiederholen würde! https://t.co/ckRokv68oC,Twitter for iPhone,0,+41794220080 8124 Maur/ZH/CH.,,
1348670110102380549,11-01-2021,MPKlausVogt,Gastronomie im Lockdown: Wie geht es den Wirten?: https://t.co/FdugJVpuWa,Twitter Web App,0,Mainfranken,,
1348670084466749453,11-01-2021,Winne__,"Politiker haben erstaunlich schnell gelernt, beim Thema Corona Pandemie auf Experten zu hören bevor sie etwas sagen. Warum funktioniert das in anderen Bereichen nicht? https://t.co/gLsf4iJD3T",Twitter for Android,0,::1,,
1348670083464376320,11-01-2021,lfsnrw,"Fakt ist: die Prüflinge sind zu schützen! Ob da eine generelle Maskenpflicht hilft, ist jedoch fraglich. Stattdessen: Möglichkeit einräumen, trotz Ladung den Klausuren im Januar fernzubleiben, so wie man es bereits im ersten Lockdown durfte. (1/2) https://t.co/mlsHthBARM",Twitter for Android,0,,,
1348670077923713028,11-01-2021,schreiberleser,"""eine brutale Ausweglosigkeit"" – Max Bauer, Graphic Novel | Corona-Bibliothek  @SWR2 @oblomovedizioni #AndreaSerio #RhapsodieInBlau #RhapsodyInBlue #Gershwin #Mussolini #Faschismus #WW2 #schreiberleser https://t.co/DbOXguyYGv",Twitter Web App,0,"Hamburg, Germany",,
1348670054766964736,11-01-2021,NIB_2015,Neues Corona-Dashboard: So berechnest du den 15-Kilometer-Radius von deinem Wohnort https://t.co/i2llyy5WCP via @t3n,Twitter Web App,0,,,
1348670019853574157,11-01-2021,Ricarda_Lang,"Für alle, die jetzt vor einem Endlos-Lockdown warnen und deshalb für eine Lockerung der Regeln plädieren: Zögerlichkeit verkürzt die Zeit harter Entbehrungen nicht, sie verlängert sie. Je mehr wir jetzt lockern, desto länger werden die Einschränkungen andauern. #Corona",Twitter for iPhone,23,Berlin,"Place(_api=<tweepy.api.API object at 0x0000027537100040>, id='3078869807f9dd36', url='https://api.twitter.com/1.1/geo/id/3078869807f9dd36.json', place_type='city', name='Berlin', full_name='Berlin, Germany', country_code='DE', country='Germany', contained_within=[], bounding_box=BoundingBox(_api=<tweepy.api.API object at 0x0000027537100040>, type='Polygon', coordinates=[[[13.088304, 52.338079], [13.760909, 52.338079], [13.760909, 52.675323], [13.088304, 52.675323]]]), attributes={})",
1348669994553503748,11-01-2021,CovidAnalyser,Eine Wirtin hat Existenzängste und öffnet unter allen Sicherheitsmassnahmen ihr Restaurant. Trotzdem droht ihr jetzt sogar der Patent-Entzug! Wo ist die Verhältnismässigkeit? #WirMachenAuf #COVID19 #Corona #verhältnismässigkeit #bundesrat #bag #lockdown,Twitter for iPhone,2,,,
1348669968313954305,11-01-2021,manafart,Warum hat sich bis jetzt keiner unser spitzen Politiker öffentlich impfen lassen um als gutes Beispiel voranzugehen! Laut News gibt es überall Zurückhaltung bei der Impfung. #COVID19 #Impfstoff #impfung,Twitter for iPhone,0,Mars,,
1348669903117688834,11-01-2021,VMonitor,"Europäischen Lebensversicherer können Corona-Schäden auffangen, meint Moody's. Ihnen könnte jedoch der Qualitätsabrieb auf der Kapitalanlagenseite zum Verhängnis werden. https://t.co/Yzw1JZOxgJ",Hootsuite Inc.,0,Köln,,
1348669888697655298,11-01-2021,RND_de,"Immer wieder verkaufen Anbieter Jacken und Rucksäcke von #Lieferando über #Ebay Kleinanzeigen. Dabei wird die Kleidung mit dem Logo des Lieferdienstes als „Lockdown-Trick“ beworben, mit dem Käufer angeblich die nächtliche #Ausgangssperre umgehen können. https://t.co/mcCLp5AJl3",TweetDeck,2,Hannover,,
1348669856967778305,11-01-2021,alpan_sagsoz,"Entweder der Lockdown und die Masken im Freien haben klare Effekte gebracht, u.a leere Krankenhäuser, oder, der Lockdown ist ein so fatales Verbrechen an Bundesbürgern ohne evidenzbasierten Effekt, dass es nur kracht. Noch heute kündigt Söder nur Verschärfungen an. Wofür?",Twitter Web App,0,Luxhausen,,
1348669853486505984,11-01-2021,StZ_NEWS,Niederländische Gastronomen trotzen dem Lockdown: Wirte proben den Corona-Aufstand https://t.co/CfRWaWs93P,Echobox,0,"Stuttgart, Germany",,
1348669847245385730,11-01-2021,StZ_NEWS,München: Millionen-Betrugsverdacht bei Corona-Soforthilfen vor Gericht https://t.co/UX1tLO2aVD,Echobox,0,"Stuttgart, Germany",,
1348669835136405506,11-01-2021,KomischeKuenste,"""Wird der Lockdown jetzt für immer andauern?"" hab ich unser Büchlein DAS KLEINE WIENER ORAKEL grade gefragt... https://t.co/18RKJMHwmu",Twitter Web App,0,MQ Wien,,
1348669750893805568,11-01-2021,pflegeberufe_ch,"""Heute noch munter, morgen vielleicht schon in kritischem Zustand: #Corona macht den #Alltag im #Pflegeheim zur turbulenten Berg- und Talfahrt.""https://t.co/e9rlnSYlxi https://t.co/f0nGEbnvhN",TweetDeck,0,Schweiz,,
1348669750709264386,11-01-2021,dw_deutsch,Strengere Corona-Regeln: Das gilt ab jetzt in ganz Deutschland https://t.co/EFuLF478hm,TweetDeck,4,"Bonn, Germany",,
1348669717939163136,11-01-2021,GruberAnonymous,RKI zu PCR-Tests: Corona-Inzidenz unter 100 nicht erreichbar https://t.co/BVnyo33l8T via @China_Welt_News,Twitter Web App,2,Deutschland -  Italien,,
1348669707541491712,11-01-2021,mihrihokage,"corona,lockdown etc. hat so schlechte folgen auf die bildung der kinder. die drittklässler tun sich mittlerweile schwer 45+14 zusammzurechnen, da sie die ganze zeit mit den gedanken an der playstation sind. ich krieg die krise",Twitter for iPhone,1,"Yozgat Merkez, Yozgat",,
1348669692119027718,11-01-2021,ZDFheute,Im Superwahljahr 2021 richten die Grünen auf ihrer Vorstandsklausur einen Themenschwerpunkt auf die #Corona-Pandemie. Sie fordern zusätzliche Maßnahmen und ein 500-Milliarden-Euro-Investitionsprogramm. https://t.co/hEizgRG6Cj,Yuzzit Pro,5,Mainz,,
1348669670384168963,11-01-2021,HxnriMOIN,Die Blocks von Handofblood verbreiten sich schneller als corona,Twitter for Android,1,,,
1348669669134249985,11-01-2021,kontexterin,"Wir müssen davon ausgehen, dass #Soeder, #Lauterbach und natürlich #Merkel eine nicht mehr klammheimliche Freude daran haben, das Volk mit maßlosen #Corona Maßnahmen zu quälen. Anders wären absurde #RAF Vergleiche nicht zu erklären.",Twitter for Android,0,Nah am Wasser,,
1348669653632102406,11-01-2021,thisisworld6,China 🇨🇳Tagelang versuchten Experten vom WHO (World Health Organization) [Weltgesundheitsorganisation] ohne Erfolg nach China einzureisen. Doch nun durften sie einreisen. Sie wollen gemeinsam den Ursprung von Covid 19 erforschen 🦠 #China #worldhealthorganization #newstime,Twitter for Android,0,Deutschland,,
1348669653279776768,11-01-2021,AlfredHoch,Gerade beim Testen in der #Messe Wien gewesen. Katastrophal wenig los. #CoronaVirusAT #Corona,Twitter for Android,0,Wien,,
