tweet_id,date,username,tweet,source,retweet_count,user_location,user_place,coordinates
1352292581292580864,21-01-2021,nahenews,Nahe-News AKTUELL!Corona-Update für den Kreis Mainz-Bingen und der Stadt Mainz: Ausbruch in Gensinger PflegeheimMehr unter https://t.co/SFjcTIE9EH #nahe #news#corona #infizierte #statistic #bingen #test #covid19 #aha #mundschutz #winter #ingelheim #mainz #taskforce #warnampel https://t.co/uI6bqO76tR,Twitter Web App,0,55585 Oberhausen/Nahe,,
1352292572648116224,21-01-2021,BUKOPharma,"Das Zurückhalten von Infos zu #COVID19 #Impfstoffen durch die Pharmaindustrie kostet Menschenleben. Das kritisiert auch Jörg Schaaber von der BUKO Pharma-Kampagne. Heute Abend, 21.15 Uhr @ARD_Press @ndrund schon jetzt online:https://t.co/2aR7le8GEG",Twitter for Android,2,,,
1352292571805052931,21-01-2021,dieterihr,Merkel: Harter Corona-Kurs ist politische Entscheidung. Direkt aus der B... https://t.co/qizA4hdhzn via @YouTube,Twitter for iPad,0,"Berlin, Deutschland",,
1352292571029110788,21-01-2021,la_capra_65,"Hierzulande läuft was schief. Es darf nicht heißen: Inzidenz senken ODER Risikogruppen schützen, sondern Inzidenz senken UND Risikogruppen schützen. Dass das derzeit nicht gelingt, zeigt ausgerechnet der Vergleich mit den USA.#COVID19 #Corona #lockdown https://t.co/OKcTpePVPy",Twitter for Android,0,Here and now,,
1352292557527658498,21-01-2021,StN_News,Landtag streitet über Lockdown: Kretschmann verneint Wahlkampf https://t.co/m18izXphIB,Echobox,0,"Stuttgart, Germany",,
1352292521901248512,21-01-2021,StefaniaFalone,Corona-Liveblog: „Dramatische“ Zahlen: Lage in Portugal spitzt sich zu https://t.co/qqnBwzRgTI via @faznet,Twitter Web App,0,,,
1352292521083285514,21-01-2021,tonline,Animation: Die Übersterblichkeit in Deutschland nimmt zu – aber nicht nur wegen Corona https://t.co/PotXHiM2Zk https://t.co/PEiM7gnKYt,Buffer,0,"Berlin, Deutschland",,
1352292511717449731,21-01-2021,hdw_bs,Um 18 Uhr startet der Livestream zum Themenabend mit Fragen und Antworten rund um die #COVID19 Impfung: https://t.co/Kxo4wwB0yK. Schaut rein und stellt eure Fragen über Slido: https://t.co/hk24A1FlCT.,Twitter Web App,0,Braunschweig in Niedersachsen,,
1352292489252769799,21-01-2021,RAADARde,Grundrechte: Unser Datenschutz verhindert eine wirksame Corona-Warn-App - WELT via @welt  https://t.co/U5SF9S2TgM,Raadar_Twitter,0,"Berlin, Deutschland",,
1352292475726082050,21-01-2021,Volksstimme,#Coronavirus in #SachsenAnhalt: Die Zahl der täglich gemeldeten Neuinfektionen ist heute auf 924 gestiegen. https://t.co/O4gxAOVaoY,TweetDeck,0,Magdeburg,,
1352292475692576770,21-01-2021,jouwatch,"Erst Piks, dann Likör, so wirbt ein Lahnauer Pflegeheim für die Corona-Impfung https://t.co/ABiY57oWDR",WordPress.com,4,Berlin,,
1352292464175026176,21-01-2021,UlrikeEhmann,Überraschung mit Covid- Richtlinien:WHO aktualisiert COVID-19-Testrichtlinien - eine Stunde nach Bidens Amtseinführung https://t.co/6kd5RMgpFJ via @China_Welt_News,Twitter for Android,0,Fränkisches Seenland,,
1352292440690941952,21-01-2021,AufsGGvereidigt,"Wenn die #KomikeranderMacht der #Opposition ""beispiellose #Naivität"" vorwerfen, weil digitale #Schulbücher nicht ""innerhalb von 9 Monaten auf den Markt"" zu bringen wären, fragt sich, wer (hinter'm Mond?) seiner ""Naivität"" fröhnt!?#Piazolo #Bildung #Bayermhttps://t.co/TGp9rXbVSd",Twitter for Android,0,,,
1352292434093465602,21-01-2021,ApothekeAdhoc,"In einem Gebäude des weltgrößten Impfstoffproduzenten in #Indien ist ein großes #Feuer ausgebrochen. Dem indischen Fernsehsender #NDTV zufolge sei es aber unwahrscheinlich, dass das Feuer die #Corona-Impfstoff-Produktion beeinträchtige. #AstraZeneca https://t.co/xZVmpnLkrz https://t.co/fIA4TxeJMe",AgoraPulse Manager,0,Berlin,,
1352292427722346499,21-01-2021,idw_online_de,Statement: Arbeitgeber darf Covid-19-Impfung nicht verlangen https://t.co/LELgXxTooK,idw,0,Germany,,
1352292425948139520,21-01-2021,justus_truth,"Wer es glaubt... Wie hoch sind denn die Opportunitätskosten? Kann man die wenigen tatsächlich Job-relevanten Lernausfälle nicht in Kürze nachholen?#Ifo-Berechnung: Schulausfall kostet zukünftige Generationen bis zu 3,3 Billionen Euro https://t.co/VFj4yuA7wj via @derspiegel",Twitter for Android,0,Deutschland,,
1352292418339688451,21-01-2021,RicardaRighetti,"Das Café Kellermann in #Babelsberg braucht Hilfe. Es könnte sonst sein, dass es den Corona-Lockdown nicht übersteht: https://t.co/TQDAr9ZGOI@maz_online #Potsdam",Twitter Web App,2,,,
1352292416246714373,21-01-2021,POLYASVoting,"Wie wurde die Online-Stimmabgabe auf dem #CDU #Parteitag überprüfbar? Durch individuelle Prüfcodes. Wie die funktionieren, hat sich der Podcast @LageNation von POLYAS erklären lassen. Ab Minute 17.30 geht’s los! #LnD #eVoting #cdupt21 https://t.co/B3eUDF900k",Hootsuite Inc.,0,"Berlin & Kassel, Germany",,
1352292409078644741,21-01-2021,schicksieweg,"Jetzt aber raus aus dem Lockdown! Ab ins DAIOS COVE! Jetzt die Frühbucheraktion mit bis zu 30% Preisvorteil bis 31.1.21 nutzen!Schon ab 890,00 Euro pro Person im Doppelzimmer Sea View inkl. Halbpension! Weitere Infos bei Eurem solamento Reiseberater!#solamento#daioscove#kreta https://t.co/rU7I5IYcFd",Hootsuite Inc.,0,Essen,,
1352292408743108609,21-01-2021,puls24news,In der Debatte um geimpfte Bürgermeister erhalten betroffene Ortschefs in Salzburg nun Rückendeckung von der Politik. #puls24 #impfen https://t.co/mAztoxGbuc,TweetDeck,0,Österreich,,
1352292383334002689,21-01-2021,welt,Corona: Sind Geimpfte ansteckend? Jetzt gibt es neue Erkenntnissehttps://t.co/CjRUqkN1ZT https://t.co/zjiJPTiW81,SocialFlow,5,Berlin,,
1352292381232660486,21-01-2021,focusauto,"+++ Wissenschaftler warnen jetzt jedoch vor einem bisher unbekannten Symptom, das immer häufiger bei Infizierten auftrete. +++ https://t.co/rnFlbtFCmh",Swat.io,0,München,,
1352292380968366081,21-01-2021,srfnews,#Berset: «Die Impfaktion muss rascher vorwärts gehen.» #Coronavirus https://t.co/NYfTcQpFNc,Twitter Web App,0,Switzerland,,
1352292380951670784,21-01-2021,focusonline,"+++ Wissenschaftler warnen jetzt jedoch vor einem bisher unbekannten Symptom, das immer häufiger bei Infizierten auftrete. +++ https://t.co/FcdRIZcKvC",Swat.io,11,Deutschland,,
1352292380842582024,21-01-2021,focusgesundheit,"+++ Wissenschaftler warnen jetzt jedoch vor einem bisher unbekannten Symptom, das immer häufiger bei Infizierten auftrete. +++ https://t.co/R1AlY7LwvI",Swat.io,0,,,
1352292380674830336,21-01-2021,focusdigital,"+++ Wissenschaftler warnen jetzt jedoch vor einem bisher unbekannten Symptom, das immer häufiger bei Infizierten auftrete. +++ https://t.co/pLpwjoseNs",Swat.io,0,München,,
1352292380309917696,21-01-2021,focuspolitik,"+++ Wissenschaftler warnen jetzt jedoch vor einem bisher unbekannten Symptom, das immer häufiger bei Infizierten auftrete. +++ https://t.co/hgddw91Qxj",Swat.io,0,München,,
1352292380074979328,21-01-2021,FOCUS_TopNews,"+++ Wissenschaftler warnen jetzt jedoch vor einem bisher unbekannten Symptom, das immer häufiger bei Infizierten auftrete. +++ https://t.co/GNQFXnjjQV",Swat.io,12,Deutschland,,
1352292379689164801,21-01-2021,focusfinanzen,"+++ Wissenschaftler warnen jetzt jedoch vor einem bisher unbekannten Symptom, das immer häufiger bei Infizierten auftrete. +++ https://t.co/RRW9HfVxqH",Swat.io,0,München,,
1352292379273945090,21-01-2021,focussport,"+++ Wissenschaftler warnen jetzt jedoch vor einem bisher unbekannten Symptom, das immer häufiger bei Infizierten auftrete. +++ https://t.co/jSSlHl4Q9y",Swat.io,0,München,,
1352292378833510400,21-01-2021,focuskultur,"+++ Wissenschaftler warnen jetzt jedoch vor einem bisher unbekannten Symptom, das immer häufiger bei Infizierten auftrete. +++ https://t.co/lyLEqX9eis",Swat.io,0,München,,
1352292378669838337,21-01-2021,manager_magazin,"Corona-Impfstoff: Biontech und Pfizer liefern mehr Impfdosen pro Ampulle, dafür aber weniger Ampullen https://t.co/Rc7033XbPs",dlvr.it,1,"Hamburg, Deutschland",,
1352292378510553091,21-01-2021,focusreise,"+++ Wissenschaftler warnen jetzt jedoch vor einem bisher unbekannten Symptom, das immer häufiger bei Infizierten auftrete. +++ https://t.co/nMzQ8c9FxS",Swat.io,0,,,
1352292378292477952,21-01-2021,focuswissen,"+++ Wissenschaftler warnen jetzt jedoch vor einem bisher unbekannten Symptom, das immer häufiger bei Infizierten auftrete. +++ https://t.co/nBdRXtnhqc",Swat.io,0,München,,
1352292378149867535,21-01-2021,focuspanorama,"+++ Wissenschaftler warnen jetzt jedoch vor einem bisher unbekannten Symptom, das immer häufiger bei Infizierten auftrete. +++ https://t.co/dGd77SsKYE",Swat.io,13,"München, Bayern",,
1352292377386508289,21-01-2021,passurpris,Wer ist hier ernsthaft überrascht? https://t.co/u7oQR7dFUH,SanLMBot,0,,,
1352292377336156162,21-01-2021,Makeimer,https://t.co/0fXv4QHUGT wie kann man so eine Scheiße berechnen??,Twitter for Android,0,"Münster, Deutschland",,
1352292375410987008,21-01-2021,irmtraut44,"Gerade bekommen:So packen wir's- die Anti Corona Strategie der SPÖ!Vernünftig, sachlich, wirksam!!😍😍😍🍀🍀🍀❤️❤️❤️",Twitter Web App,0,,,
1352292374563741696,21-01-2021,BeingMom1,"Mit Chlorreiniger das Bad putzen, die Augen schließen und sich vorstellen, man wäre im Schwimmbad.#Corona",Twitter for iPhone,0,,,
1352292373062168578,21-01-2021,Vontobel_SP_DE,"#StrukturierteProdukte auf #Airbnb gefällig? Hier entlang, bittte: https://t.co/caGwWZPz2d #Tech #IPO #Tourismus #Reisen #Travel #Corona #Lockdown #Börse #Geldanlage #Trading #Investing #Finanzen #Aktien https://t.co/BYEq7CNXK6",TweetDeck,0,Frankfurt am Main,,
1352292372726464512,21-01-2021,it_ruhr,"Oh man! Auch wenn die Studie aus 2019 ist, tut das schon weh! Ob Deutschland da durch die Corona-Zeit ein paar Plätze gutmachen konnte? Wir werden sehen... Wir versuchen auf jeden Fall, da etwas beizutragen! Z.B. mit unseren #MeetingCards, #OnlineWorkshops &amp; #TrainTheTrainer https://t.co/P4F0M7kU8r",Twitter Web App,0,Ruhrgebiet,,
1352292372571254784,21-01-2021,WAZ_Redaktion,"Frau D. sitzt am Tisch, sie sagt ""Aua"" mit langem A. Dabei tut es gar nicht weh, das sagen alle, auch Frau F. auf ihrem Bett. ""Alles gar nicht so schlimm!"", ruft sie dem Arzt hinterher.Zu Gast beim Impftermin im Seniorenstift St. Josef in #Essen.https://t.co/hIkw7cMqxJ",TweetDeck,0,Essen,,
1352292357631315970,21-01-2021,Mariechristiin_,"Wäre Corona im Schulsystem nicht schon belastend genug, dann auch noch 6,5 Jahre Ausbildung L E I D E R   S I N N L O S, weil dann jeder SoWi mit Zertifikat unterrichten kann und WIR leider unterqualifiziert sind 👏 #ciaoBildung @ArminLaschet @BildungslandNRW #Gebauer",Twitter for iPhone,0,"Düsseldorf, Deutschland",,
1352292357354479618,21-01-2021,tonline,"Die Sterbefallzahlen in Deutschland liegen derzeit 25 Prozent über dem Durchschnitt. Dass das nicht nur an #Corona liegt, zeigen @Sandra_Sperling und Adrian Röger in ihrer Analyse: https://t.co/gcmpZ5Ip1K",TweetDeck,1,"Berlin, Deutschland",,
1352292347107831820,21-01-2021,cushingura,"Wenn du bei #menstruation, erstmal #Mutation liest, hast du definitiv zu viele Berichte über #COVID19 gelesen.Schluss für heute.",Twitter Web App,0,,,
1352292308587339779,21-01-2021,marcelpacer,"Wieviel Jahre bekommt man eigentlich, wenn man dem Typen einen Tritt in seinen königlichen Arsch verpasst und den aus Deutschland rauskickt? Ist der und sein Gefolge am Ende sogar für die fremdartigen Corona-Varianten in Garmisch-Partenkirchen verantwortlich??? Herr Maas??? 🤐 https://t.co/5tiWroJehM",Twitter Web App,0,"Köln, Nordrhein-Westfalen",,
1352292291495518209,21-01-2021,szbautzen,Die Corona-Pandemie setzt auch den Händlern in Bautzens größtem Einkaufszentrum zu. Mindestens ein Geschäft wird schließen. (SZ+) https://t.co/hG5xpHXhvg,IFTTT,0,"02625 Bautzen, Lauengraben 18",,
1352292287229919234,21-01-2021,szbautzen,Das Homeschooling im Lockdown stellte das Kinderhaus in Wuischke vor besondere Schwierigkeiten. Zwei Bautzener Vereine helfen. https://t.co/BEVHTqJHog,IFTTT,0,"02625 Bautzen, Lauengraben 18",,
1352292273275498496,21-01-2021,Bettina_Jarasch,"Mit @schwarzblond spreche ich Sa 17h auf #Clubhouse über #Homeoffice. Heute Gesundheitsschutz, bietet es nach Corona viele Chancen, einige Herausforderungen und wird bleiben. Bei Clubhouse weiß ich das noch nicht. Freu mich aber darauf, es auszuprobieren. https://t.co/psws9Qtw58 https://t.co/HLVzYMcOcO",Twitter Web App,2,"Berlin, Deutschland",,
1352292266954678274,21-01-2021,donaukurier,FCI-Spiel gegen Uerdingen vor Absage https://t.co/F2oTwTlBLg,CleverPush,0,Ingolstadt,,
1352292263372664836,21-01-2021,horkar2,"#Schweden An alle die das Posten und meinen in schweden wäre ohne lockdown genau so ergangen.Ja gleich viele Tote wie wir in DeutschlandProblem ist nur das wir hier in Deutschland ca 8mal mehr Einwohner haben bei der Todeszahl B.p.18000-10000000=0,18%18000-80000000=0,0225%",Twitter Web App,0,,,
1352292248550043652,21-01-2021,gabonn,Die Kultusminister sind sich einig: Abschlüsse während der #Corona-Pandemie sollen nicht weniger wert sein als sonst.  https://t.co/uOA1pAIEHq,Echobox,0,Bonn,,
1352292239343562752,21-01-2021,GrebLupo,Merkel sorgt sich rührend um Kinder im Lockdown – sofern sie kein Deutsch können https://t.co/BzqXNddAHZ via @jouwatchDie Stasi-Qualle ist nicht mehr Tragbar.Der Stasi Dreck muss weg.,Twitter Web App,3,,,
1352292231756046336,21-01-2021,shrou_ded,Funktioniert die #Corona App eigentlich noch?,Tweetbot for iΟS,0,Berlin,,
1352292209404616715,21-01-2021,RND_de,"Angela #Merkel warnt vor einer dritten #Corona-Welle. Wenn man die Kanzlerin reden hört, kann man kaum an ein Ende des #Lockdown am 14. Februar glauben. https://t.co/8fsPik1l9J",TweetDeck,2,Hannover,,
1352292141142339586,21-01-2021,epsilon3141,"Allein in NYC während der 1. #covid-Welle haben 4000 Kinder durch #corona ein Elternteil verloren.Wenn wir Durchseuchung zulassen, werden DE-weit mehr als 10.000 Menschen *unter* 60 Jahren sterbenViele tausend Kinder und Jugendliche werden Vater oder Mutter verlieren https://t.co/w73v3dCJWV",Twitter Web App,15,,,
1352292123748478977,21-01-2021,faznet,Breel #Embolo soll trotz #Corona-Pandemie an einer illegalen Party teilgenommen haben und über das Dach vor der Polizei geflüchtet sein. Nun äußert sich sein Trainer Marco Rose. https://t.co/L8ljrUE1wR,Buffer,1,Frankfurt am Main,,
1352292109215277057,21-01-2021,OgerleReiner,Hahaha diese Hetzer von der #bild. Jeder weiß das es auf #blacklivesmatter Demos usw sowas wie #COVID19 nicht gibt.  #Biden #Trump #Corona https://t.co/EfEyiUSCjl,Twitter for Android,0,,,
1352292076562558978,21-01-2021,Pietbull47,"Treffender Kommentar von #DieterStein, Chefredakteuer der #JungeFreiheit: Die Regierung Merkel versucht mit immer härterem und unsinnigerem Lockdown von ihrem katastrophalen Versagen bei #Corona abzulenken. https://t.co/xf49QXDqyg",Twitter Web App,7,,,
1352292070233354242,21-01-2021,technikhandel91,"Soeben lese ich die Headline: ""Auf Corona könnten Steuererhöhungen folgen!"" Ich würde gerne antworten: ""Worauf ihr euch verlassen könnt!"" #steuererhoehungen #corona",Twitter Web App,0,"Düsseldorf, Deutschland",,
1352292061643501568,21-01-2021,DaisyKirsch,Carsten Watzl: Geimpfte Menschen sind laut Immunologe wohl doch ansteckend https://t.co/OE1pFpk22x via @welt,Twitter Web App,0,🇹🇭🇹🇼🇸🇬,,
1352292034128830466,21-01-2021,Schwaebische,"In dieser Phase der Corona-Krise bringt es nichts, wenn die Bundesregierung nur stur ihre Politik – und ihre Fehler verteidigt. Sie muss auch mehr Mitgefühl zeigen, kommentiert Claudia Kling. #schwaebische https://t.co/uFLw6iSbDq",Zapier.com,0,"Schwaben, Deutschland",,
1352292002893766656,21-01-2021,BR_Franken,Ausbildung und Lockdown – Was wird aus dem Nachwuchs? https://t.co/aT62XzbUE7 #franken https://t.co/mExsQKhLm1,dlvr.it,0,Franken,,
1352291948539895809,21-01-2021,DrHaidenthaler,Die Leugner finden immer neue Themen und fangen dann wieder von vorne an. Corona-Mythos Nr. 17: Containment ist nicht möglich. Zerocovid ist nicht möglich. https://t.co/O4brifEIGP,Twitter Web App,0,"Linz, Austria",,
1352291916067598337,21-01-2021,StZ_NEWS,Gegen Corona-Regeln verstoßen: Polizei beendet Geburtstagsparty in Ulm https://t.co/L9QLSLUGZi,Echobox,0,"Stuttgart, Germany",,
1352291903153336326,21-01-2021,lr_wsw,"Ab kommender Woche bietet der #Kreisverband vom #DRK in #Weißwasser die Möglichkeit für jeden, #Schnelltests zu machen. Eine Anmeldung ist aber erforderlich. #Sachsen #CoronaSN https://t.co/hefhnTqBBF",Twitter for iPhone,1,Weißwasser/Oberlausitz,,
1352291883163275264,21-01-2021,BernerZeitung,Jetzt live: Bundesrat Alain Berset und der oberste Gesundheitsdirektor Lukas Engelberger äussern sich zur Corona-Situation. https://t.co/dp69MXeWHu,Twitter Web App,0,Bern,,
1352291867430445060,21-01-2021,jetzt,Geburtstagsgeschenke basteln und nebenher mit einer Freundin telefonieren ist die perfekte Corona-Abendbeschäftigung. #wirhabenverstanden,TweetDeck,0,München,,
1352291839219556356,21-01-2021,luca_gerhardt,"Die Impfung wird *eventuell* keinen Infektionsschutz bieten, höchstwahrscheinlich aber mindestens den Krankheitsverlauf stark mildern.https://t.co/6aycNSWQi9",Twitter Web App,0,"Dresden, Germany",,
1352291829832687625,21-01-2021,MPKlausVogt,Friseure im Lockdown: Warten auf staatliche Hilfe: https://t.co/ZCQdR7UtHg,Twitter Web App,0,Mainfranken,,
1352291823369248773,21-01-2021,iceventure,"#COVID19 + #Politik zwingt viele #KMU zur #Digitalisierung &amp; #Homeoffice. Die große Frage ist die #Produktivität der #Mitarbeiter -&gt; lesen Sie Fakten, Zahlen, Erfahrungen &amp; den Zusammenhang mit #Digitalisierung &amp; richtige Nutzung der Tools #Office365https://t.co/D0s2HGhTKq",Twitter Web App,0,,,
1352291821477654528,21-01-2021,susannewiest,"""Bedingungen, für wen Unterstützung infrage komme, änderten sich ständig. „Es ist einfach nicht ganz klar, wer da reinpasst. Das schreckt viele ab – auch mich – weil ich Angst davor habe, dass ich dann das Geld eventuell zurückzahlen muss.“""#Grundeinkommenhttps://t.co/doKDiEDnDS",Twitter Web App,4,,,
1352291810731814913,21-01-2021,DIVI_eV,"Unser Präsident Prof. Gernot Marx ist morgen bei der BPK um 10:00 Uhr zu sehen und zu hören gemeinsam mit dem Bundesminister für Gesundheit Jens Spahn, Prof. Lothar H. Wieler und Prof. Christian Drosten zum Thema ""Corona-Lage im Lockdown"".https://t.co/K9wv4wZ8bW https://t.co/9eLk1JfWFR",Twitter for Android,4,Berlin,"Place(_api=<tweepy.api.API object at 0x000002ADEFC90040>, id='3078869807f9dd36', url='https://api.twitter.com/1.1/geo/id/3078869807f9dd36.json', place_type='city', name='Berlin', full_name='Berlin, Germany', country_code='DE', country='Germany', contained_within=[], bounding_box=BoundingBox(_api=<tweepy.api.API object at 0x000002ADEFC90040>, type='Polygon', coordinates=[[[13.088304, 52.338079], [13.760909, 52.338079], [13.760909, 52.675323], [13.088304, 52.675323]]]), attributes={})",
1352291804322914304,21-01-2021,Stanislaus2210,"Gerade kamen mir beim Spazierengehen drei Jungs im Alter von ca. 10-12 Jahren auf Fahrrädern - natürlich nebeneinander fahrend - entgegen. Einer wollte mich wirklich über den Haufen fahren. #Corona und die Nebenwirkungen macht krank, auch im Kopf.",Twitter for Android,0,Transrhenanien,,
1352291783611457538,21-01-2021,huntingnagash,"Mich erinnert die @DieTechniker aktuell ein wenig an die #Versicherung im Buch ""Der Regenmacher"" von @JohnGrisham #COVID19",Twitter Web App,0,,,
1352291772563652610,21-01-2021,Grund_gesetzt,"Prof. Christoph Lütge, Mitglied des Bayerischen Ethikrates und Lehrstuhlinhaber der TU München, räumt auf:„Die Krankenhäuser sind nicht überlastet.“„Mit 84 Jahren stirbt man schon mal — an Corona oder was anderem. Das kommt vor.“Danke, @MorgensternRom1 https://t.co/qQyqfbtFpY",Twitter for iPhone,39,,,
1352291749666975747,21-01-2021,sifuadventure,"Unpopuläre Meinung: Es wäre jetzt an der Zeit, an wirksamen medizinischen Masken zu forschen, die man wiederverwenden kann.Die jetzigen Masken sind notwendig, aber nicht nachhaltig. Da muss sich auf kurz oder lang was ändern.#Maskenpflicht #FFP2 #Corona",Twitter for iPhone,0,"Bonn, Deutschland",,
1352291738510094339,21-01-2021,BurkhardtPhilip,"Gesundheitsminister @alain_berset spricht von einer ""erfreulichen"" Entwicklung angesichts der sinkenden #COVID19-Fallzahlen. Ab morgen würden 2x pro Woche Zahlen über die #Impfungen publiziert. https://t.co/f6UK4V9FD1",Twitter for Android,0,Medienzentrum Bundeshaus Bern,,
1352291704410419200,21-01-2021,1887henne,Das sollte jeder*innen wissen#Corona #Impfung #Impfstoff #Moderna #BioNTechpfizer #COVID19 https://t.co/8P8cVNdj5L,Twitter for Android,0,37° 49′ 36″ N   122° 25′ 24″W,,
1352291670134546434,21-01-2021,rosenkranzBW,"Bereits morgen, 22. Januar, wird gemeldet werden, dass es mehr als 50.000 Corona-Tote gibt. Und es sind noch 10 Tage bis zum 1. Februar, die 60.000er Marke rückt näher. Grund genug - Globalisierung ! - überall rumzufragen, wo noch auf die Schnelle Impfstoff zu kriegen ist ?!!",Twitter for iPhone,0,"Hamburg, Deutschland",,
1352291656389849088,21-01-2021,NsSchussler,Soziologin Allmendinger über Corona und Geschlechtergerechtigkeit - Junge Mütter sind die größten Leidtragenden https://t.co/hzwhwNjXi9,Twitter Web App,0,"Würzburg, Bayern",,
1352291655899086848,21-01-2021,funkschau_de,Laut #Bitkom erholt sich die IT-Branche wieder vom Corona-Schock. Was sind die größten Umsatztreiber?Hier lesen:https://t.co/FXrjiwVC0Y https://t.co/ME9FS6AymP,Twitter Web App,0,"Haar, Bayern",,
1352291648017993728,21-01-2021,satzverstand,"Habe für @_GGDigital die Gesundheitspol. der dt. Ratspräsidentschaft analysiert u. mit EU-Politiker @peterliese gesprochen. #Corona hat gemeinsames Handeln forciert. Bin aber skeptisch, dass die Einzelstaaten ""harte"" Kompetenzen abgeben. https://t.co/qChdvZ7Stp @germanyintheeu https://t.co/v6SMhoyKMN",Twitter Web App,1,"Bonn, Deutschland",,
1352291615956725762,21-01-2021,fr,Angela Merkel hat sich heute zu den #Corona-Regeln geäußert. Ein Überblick über die #Bundespressekonferenz der Bundeskanzlerin. https://t.co/3hpfWjmeuz,TweetDeck,1,"Frankfurt, Hessen",,
1352291541663051780,21-01-2021,simonszu,"Die vorgeschlagenen Maßnahmen werden auch immer absurder. Ich kann diesen ""Kampf"" gegen Corona nicht mehr ernst nehmen. Dieses ""schaffen wir gemeinsam"" kann glaub ich in die Tonne jetzt 😢 https://t.co/MJ3ndlbKi9",Fenix 2,0,"Dortmund, wo sonst? ",,
1352291489347461128,21-01-2021,StadtRE,Die aktuellen #Corona-Zahlen im @kreis_re: #StayHome https://t.co/nEhNxlNFod,Twitter Web App,0,"Recklinghausen, NRW",,
1352291483244748801,21-01-2021,tzmuenchen,Lebensbedrohlich ist #SARSCoV2 besonders in Alten- und Pflegeheimen.#Pflege #CoronaVirusDE #Covid19 #todesfällehttps://t.co/d7ZG4TwsRT,TweetDeck,0,München,,
1352291475544014850,21-01-2021,JulikaBrand,"wenn von #Geimpften 7 sterben, aber nur 1 von den Nicht- Geimpften...🤔(#Corona-#Impfung bei #Risikogruppen)https://t.co/hGz8QQWmEk",Twitter Web App,1,Allgäu (Bayern),,
1352291471894917121,21-01-2021,fuchsfeuerwerk,Servus-TV Corona-Experte Dr. Stefan Wöhrer zur allgemeinen Gefährlichkeit bzw. Ungefährlichkeit des Coronavirus im März 2020. #Corona #Covid19 #MickyMausVirus https://t.co/nmHquomiDC,Twitter Web App,0,,,
1352291429457027073,21-01-2021,mawz_wien,"Wer kann sich noch an die Zeiten vor COVID erinnern als man noch Kurse und Seminare besuchen konnte?! 😢 Hoffentlich geht das bald wieder, wir würden uns jedenfalls freuen 😇#kurse #seminare #mawz #covid #lockdown https://t.co/uwEG9fsFgr https://t.co/cPQX6l9rPd",IFTTT,0,Wien,,
1352291424105070601,21-01-2021,PGAofGermany,Der Lockdown dauert an! Dr. Andreas Katzer von der Kanzlei Sonntag &amp; Partner hat im Auftrag der PGA of Germany die Informationen zu den Wirtschaftshilfen des Staates für Betriebe und Unternehmer aktualisiert. Das PDF-Dokument gibt's zum Download auf der https://t.co/QyUCc4SUsK. https://t.co/QUIutkpFtL,Twitter Web App,0,München,,
1352291404064686089,21-01-2021,buchfieber,"Nach vier Jahren mit dem unzivilisierten barbarischen Drecksack muss man die neuen Nachrichten aus den #USA zweimal lesen, um sie zu glauben. Schon lang nicht mehr so viele gute Nachrichten wie heute geteilt. #WHO #COVAX #BidenHarris #Fauci #COVID19 #HIV #Malaria https://t.co/MD7MNyp68F",Twitter Web App,0,"Grenzgängerin, mittendrin",,
1352291402126946305,21-01-2021,HelmutZecha,1/x CORONA: Zwischen #NoCovid / #ZeroCovid und #MitVirenLeben: EINE KONTROVERSE – UNVERSÖHNLICH ausgetragen. Im Folgenden einige Sichtweisen.#Corona #COVID19 #COVID19de #Inzidenz #Impfen #Merkel #Portugal #RKI https://t.co/Suw2VYthQc,Twitter Web App,0,Burghausen,,
1352291396510740482,21-01-2021,citoyenlady,"#Bestatter spricht Klartext: „Nicht überall wo Corona draufsteht, ist Corona drin“ https://t.co/X0HOdZ83Mm via @DrDavidBerger  Tja... Wieder eine Verschwörungstheorie, die keine ist..",Twitter Web App,2,,,
1352291385714458626,21-01-2021,Dt_Aerzteblatt,Africa CDC: Nicht genug Sauerstoff im Kampf gegen Corona in Afrika:  Addis Abeba – Im Kampf gegen die zweite Welle der Coronapandemie in Afrika hat der Kontinent nach Angaben der führenden Gesundheitsorganisation keine… https://t.co/GiH34lkPlB #Africa #COVID19 #CDC https://t.co/tkQuZDz8LJ,dlvr.it,2,Germany,,
1352291382606536704,21-01-2021,jobwrk,"Familien, bei denen im Lockdown der »Haussegen schief hängt«, für einen Coaching-Beitrag: Während der Pandemie lebt so manche Familie 24 Stunden auf engsten Raum zusammen. Die Folge können Konflikte und Streitereien sein – der Haussegen hängt schief.… https://t.co/Hipn2yS1hA https://t.co/eovMzGyjmv",dlvr.it,0,,,
1352291380106850305,21-01-2021,Niemi3000,Wer im Lockdown die ganze Zeit Zuhause ist kann sich auch vor ne Lampe setzen und mit seinem Schatten quatschen. Der hört wenigstens zu.Er kann auch super tanzen#LifeHack,Twitter for Android,1,"Potsdam, Deutschland",,
